text,label,category,lang,source
i walked an hour 2 c u! doesnï¿½ï¿½t that show i care y wont u believe im serious?,0,safe_generic,en,uci_spam
18 days to euro<otp> kickoff! u will be kept informed of all the latest news and results daily. unsubscribe send get euro stop to <otp>.,1,generic_spam,en,uci_spam
are you available for soiree on june 3rd?,0,safe_generic,en,uci_spam
do u noe wat time e place dat sells 4d closes?,0,safe_generic,en,uci_spam
"i got another job! the one at the hospital doing data analysis or something, starts on monday! not sure when my thesis will got finished",0,safe_generic,en,uci_spam
jay's getting really impatient and belligerent,0,safe_generic,en,uci_spam
hiya comin 2 bristol 1 st week in april. les got off + rudi on new yrs eve but i was snoring.they were drunk! u bak at college yet? my work sends ink 2 bath.,0,safe_generic,en,uci_spam
i'm at work. please call,0,safe_generic,en,uci_spam
then u drive lor.,0,safe_generic,en,uci_spam
ard 515 like dat. y?,0,safe_generic,en,uci_spam
tell me they're female :v how're you throwing in? we're deciding what all to get now,0,safe_generic,en,uci_spam
eastenders tv quiz. what flower does dot compare herself to? d= violet e= tulip f= lily txt d e or f to <otp> now 4 chance 2 win ï¿½100 cash wkent/150p16+,1,generic_spam,en,uci_spam
i'm working technical support :)voice process.networking field.,0,safe_generic,en,uci_spam
i might come to kerala for 2 days.so you can be prepared to take a leave once i finalise .dont plan any travel during my visit.need to finish urgent works.,0,safe_generic,en,uci_spam
ok. not sure what time tho as not sure if can get to library before class. will try. see you at some point! have good eve.,0,safe_generic,en,uci_spam
we have new local dates in your area - lots of new people registered in your area. reply date to start now! 18 only <url> replys150,1,generic_spam,en,uci_spam
"that's fine, i'll bitch at you about it later then",0,safe_generic,en,uci_spam
no my mum went 2 dentist.,0,safe_generic,en,uci_spam
once free call me sir. i am waiting for you.,0,safe_generic,en,uci_spam
meeting u is my work. . . tel me when shall i do my work tomorrow,0,safe_generic,en,uci_spam
someone u know has asked our dating service 2 contact you! cant guess who? call <acct> now all will be revealed. po box385 m6 6wu,1,generic_spam,en,uci_spam
jus finish bathing...,0,safe_generic,en,uci_spam
"alright, i'll make sure the car is back tonight",0,safe_generic,en,uci_spam
urgent! we are trying to contact u. todays draw shows that you have won a ï¿½800 prize guaranteed. call <acct> from land line. claim c52. valid12hrs only,1,generic_spam,en,uci_spam
dear u've been invited to xchat. this is our final attempt to contact u! txt chat to <otp>,1,generic_spam,en,uci_spam
lul im gettin some juicy gossip at the hospital. two nurses are talking about how fat they are gettin. and one thinks shes obese. oyea.,0,safe_generic,en,uci_spam
aight ill get on fb in a couple minutes,0,safe_generic,en,uci_spam
oi. ami parc<name>. kicchu kaaj korte iccha korche na. phone ta tul na. plz. plz.,0,safe_generic,en,uci_spam
where can download clear movies. dvd copies.,0,safe_generic,en,uci_spam
"yep, by the pretty sculpture",0,safe_generic,en,uci_spam
convey my regards to him,0,safe_generic,en,uci_spam
me too watching surya movie only. . .after 6 pm vijay movie pokkiri,0,safe_generic,en,uci_spam
you tell what happen dont behave like this to me. ok no need to say,0,safe_generic,en,uci_spam
can u get pic msgs to your phone?,0,safe_generic,en,uci_spam
send to someone else :-),0,safe_generic,en,uci_spam
wat makes some people dearer is not just de happiness dat u feel when u meet them but de pain u feel when u miss dem!!!,0,safe_generic,en,uci_spam
for me the love should start with attraction.i should feel that i need her every time around me.she should be the first thing which comes in my thoughts.i would start the day and end it with her.she should be there every time i dream.love will be then when my every breath has her name.my life should happen around her.my life will be named to her.i would cry for her.will give all my happiness and take all her sorrows.i will be ready to fight with anyone for her.i will be in love when i will be doing the craziest things for her.love will be when i don't have to proove anyone that my girl is the most beautiful lady on the whole planet.i will always be singing praises for her.love will be when i start up making chicken curry and end up makiing sambar.life will be the most beautiful then.will get every morning and thank god for the day because she is with me.i would like to say a lot..will tell later..,0,safe_generic,en,uci_spam
"fr'ndship is like a needle of a clock. though v r in d same clock, v r nt able 2 met. evn if v meet,itz only 4few seconds. bt v alwys stay conected. gud 9t;-)",0,safe_generic,en,uci_spam
i don't think he has spatula hands!,0,safe_generic,en,uci_spam
you can never do nothing,0,safe_generic,en,uci_spam
you are awarded a sipix digital camera! call <acct> from landline. delivery within 28days. t cs box177. m221bp. 2yr warranty. 150ppm. 16 . p pï¿½3.99,1,generic_spam,en,uci_spam
goodmorning today i am late for &lt;decimal&gt; min.,0,safe_generic,en,uci_spam
win urgent! your mobile number has been awarded with a ï¿½<otp> prize guaranteed call <acct> from land line. claim <otp> valid 12hrs only 150ppm,1,generic_spam,en,uci_spam
please da call me any mistake from my side sorry da. pls da goto doctor.,0,safe_generic,en,uci_spam
where r we meeting?,0,safe_generic,en,uci_spam
"well the weather in cali's great. but its complexities are great. you need a car to move freely, its taxes are outrageous. but all in all its a great place. the sad part is i missing home.",0,safe_generic,en,uci_spam
now only i reached home. . . i am very tired now. . i will come tomorro,0,safe_generic,en,uci_spam
ryder unsold.now gibbs.,0,safe_generic,en,uci_spam
<name> draw 4 ï¿½100 gift voucher will b entered on receipt of a correct ans. when was elvis presleys birthday? txt answer to <otp>,1,generic_spam,en,uci_spam
don't fret. i'll buy the ovulation test strips and send them to you. you wont get them til like march. can you send me your postal address.u'll be alright.okay.,0,safe_generic,en,uci_spam
no gifts!! you trying to get me to throw myself off a cliff or something?,0,safe_generic,en,uci_spam
been up to ne thing interesting. did you have a good birthday? when are u wrking nxt? i started uni today.,0,safe_generic,en,uci_spam
you busy or can i come by at some point and figure out what we're doing tomorrow,0,safe_generic,en,uci_spam
"yeah go on then, bored and depressed sittin waitin for phone to ring... hope the wind drops though, scary",0,safe_generic,en,uci_spam
black shirt n blue jeans... i thk i c ï¿½_...,0,safe_generic,en,uci_spam
aiyah sorry lor... i watch tv watch until i forgot 2 check my phone.,0,safe_generic,en,uci_spam
message important information for o2 user. today is your lucky day! 2 find out why log onto <url> there is a fantastic surprise awaiting you,1,generic_spam,en,uci_spam
on hen night. going with a swing,0,safe_generic,en,uci_spam
"good afternoon, my love. how goes your day ? what are you up to ? i woke early and am online waiting for you ... hmmm ... italian boy is online i see . *grins*",0,safe_generic,en,uci_spam
from someone not to smoke when every time i've smoked in the last two weeks is because of you calling or texting me that you wanted to smoke,0,safe_generic,en,uci_spam
no you'll just get a headache trying to figure it out. u can trust me to do the math. i promise. o:-),0,safe_generic,en,uci_spam
s s..first time..dhoni rocks...,0,safe_generic,en,uci_spam
ok ill tell the company,0,safe_generic,en,uci_spam
"awesome, think we can get an 8th at usf some time tonight?",0,safe_generic,en,uci_spam
so that means you still think of teju,0,safe_generic,en,uci_spam
"no i'm good for the movie, is it ok if i leave in an hourish?",0,safe_generic,en,uci_spam
no no:)this is kallis home ground.amla home town is durban:),0,safe_generic,en,uci_spam
so lets make it saturday or monday as per convenience.,0,safe_generic,en,uci_spam
hey... what time is your driving on fri? we go for evaluation on fri?,0,safe_generic,en,uci_spam
"<acct> you have won a ï¿½2,000 price! to claim, call <acct>.",1,generic_spam,en,uci_spam
i'm going 4 lunch now wif my family then aft dat i go str 2 orchard lor.,0,safe_generic,en,uci_spam
"bored of speed dating? try speedchat, txt speedchat to <otp>, if you don't like em txt swap and get a new chatter! chat<otp> pobox<otp>w45wq 150p/msg rcd 16",1,generic_spam,en,uci_spam
cancel cheyyamo?and get some money back?,0,safe_generic,en,uci_spam
do you want 750 anytime any network mins 150 text and a new video phone for only five pounds per week call <acct> now or reply for delivery tomorrow,1,generic_spam,en,uci_spam
ok.ok ok..then..whats ur todays plan,0,safe_generic,en,uci_spam
good morning princess! how are you?,0,safe_generic,en,uci_spam
aiyar sorry lor forgot 2 tell u...,0,safe_generic,en,uci_spam
for taking part in our mobile survey yesterday! you can now have 500 texts 2 use however you wish. 2 get txts just send txt to <otp> t&c <url> 1.50p,1,generic_spam,en,uci_spam
not tonight mate. catching up on some sleep. this is my new number by the way.,0,safe_generic,en,uci_spam
"height of \oh shit....!!\"" situation: a guy throws a luv letter on a gal but falls on her brothers head whos a gay",0,safe_generic,en,uci_spam
ur hmv quiz cash-balance is currently ï¿½500 - to maximize ur cash-in now send hmv1 to <otp> only 150p/msg,1,generic_spam,en,uci_spam
"so check your errors and if you had difficulties, do correction.",0,safe_generic,en,uci_spam
howz pain?hope u r fine..,0,safe_generic,en,uci_spam
u wake up already? thanx 4 e tau sar piah it's quite nice.,0,safe_generic,en,uci_spam
k do i need a login or anything,0,safe_generic,en,uci_spam
dont forget you can place as many free requests with 1stchoice.co.uk as you wish. for more information call <acct>.,1,generic_spam,en,uci_spam
lol ... no just was busy,0,safe_generic,en,uci_spam
what * u wearing?,0,safe_generic,en,uci_spam
oh:)as usual vijay film or its different?,0,safe_generic,en,uci_spam
i don't know u and u don't know me. send chat to <otp> now and let's find each other! only 150p/msg rcvd. hg/suite342/2lands/row/w1j6hl ldn. 18 years or over.,1,generic_spam,en,uci_spam
have you had a good day? mine was really busy are you up to much tomorrow night?,0,safe_generic,en,uci_spam
and is there a way you can send shade's stuff to her. and she has been wonderful too.,0,safe_generic,en,uci_spam
really... i tot ur paper ended long ago... but wat u copied jus now got use? u happy lar... i still haf 2 study :-(,0,safe_generic,en,uci_spam
"thank you, winner notified by sms. good luck! no future marketing reply stop to <otp> customer services <acct>",1,generic_spam,en,uci_spam
babe ? i lost you ... :-(,0,safe_generic,en,uci_spam
ok... help me ask if she's working tmr a not?,0,safe_generic,en,uci_spam
i'm not driving... raining! then i'll get caught at e mrt station lor.,0,safe_generic,en,uci_spam
not a drop in the tank,0,safe_generic,en,uci_spam
(that said can you text him one more time?),0,safe_generic,en,uci_spam
ok i go change also...,0,safe_generic,en,uci_spam
<otp>'s of girls many local 2 u who r virgins 2 this & r ready 2 4fil ur every sexual need. can u 4fil theirs? text cute to <otp>(ï¿½1.50p. m),1,generic_spam,en,uci_spam
did u find a sitter for kaitlyn? i was sick and slept all day yesterday.,0,safe_generic,en,uci_spam
"sorry man, accidentally left my phone on silent last night and didn't check it til i got up",0,safe_generic,en,uci_spam
hey.. something came up last min.. think i wun be signing up tmr.. hee,0,safe_generic,en,uci_spam
he's an adult and would learn from the experience. there's no real danger. i just dont like peeps using drugs they dont need. but no comment,0,safe_generic,en,uci_spam
hey! there's veggie pizza... :/,0,safe_generic,en,uci_spam
yun buying... but school got offer <otp> plus only...,0,safe_generic,en,uci_spam
you sure your neighbors didnt pick it up,0,safe_generic,en,uci_spam
k. i will sent it again,0,safe_generic,en,uci_spam
well. im computerless. time to make some oreo truffles,0,safe_generic,en,uci_spam
"haha yeah i see that now, be there in a sec",0,safe_generic,en,uci_spam
i am not having her number sir,0,safe_generic,en,uci_spam
lol now i'm after that hot air balloon!,0,safe_generic,en,uci_spam
ok . . now i am in bus. . if i come soon i will come otherwise tomorrow,0,safe_generic,en,uci_spam
msgs r not time pass.they silently say that i am thinking of u right now and also making u think of me at least 4 a moment. gd nt.swt drms @shesil,0,safe_generic,en,uci_spam
"yeah, we can probably swing by once my roommate finishes up with his girl",0,safe_generic,en,uci_spam
"got what it takes 2 take part in the wrc rally in oz? u can with lucozade energy! text rally le to <otp> (25p), see packs or lucozade.co.uk/wrc & itcould be u!",1,generic_spam,en,uci_spam
happy new years melody!,0,safe_generic,en,uci_spam
ï¿½ï¿½ dun need to pick ur gf?,0,safe_generic,en,uci_spam
yay! you better not have told that to 5 other girls either.,0,safe_generic,en,uci_spam
horrible u eat macs eat until u forgot abt me already rite... u take so long 2 reply. i thk it's more toot than b4 so b prepared. now wat shall i eat?,0,safe_generic,en,uci_spam
"did he say how fantastic i am by any chance, or anything need a bigger life lift as losing the will 2 live, do you think i would be the first person 2 die from n v q?",0,safe_generic,en,uci_spam
just nw i came to hme da..,0,safe_generic,en,uci_spam
"i'm outside islands, head towards hard rock and you'll run into me",0,safe_generic,en,uci_spam
to day class is there are no class.,0,safe_generic,en,uci_spam
i'm in chennai velachery:),0,safe_generic,en,uci_spam
you flippin your shit yet?,0,safe_generic,en,uci_spam
"k give me a sec, breaking a &lt;#&gt; at cstore",0,safe_generic,en,uci_spam
am i that much bad to avoid like this?,0,safe_generic,en,uci_spam
"yo, you around? just got my car back",0,safe_generic,en,uci_spam
annoying isn't it.,0,safe_generic,en,uci_spam
"goodmorning, today i am late for &lt;#&gt; min.",0,safe_generic,en,uci_spam
there's no point hangin on to mr not right if he's not makin u happy,0,safe_generic,en,uci_spam
all will come alive.better correct any good looking figure there itself..,0,safe_generic,en,uci_spam
in that case i guess i'll see you at campus lodge,0,safe_generic,en,uci_spam
we're done...,0,safe_generic,en,uci_spam
come to my home for one last time i wont do anything. trust me.,0,safe_generic,en,uci_spam
i was up all night too worrying about this appt. it's a shame we missed a girls night out with quizzes popcorn and you doing my hair.,0,safe_generic,en,uci_spam
sex up ur mobile with a free sexy pic of jordan! just text babe to <otp>. then every wk get a sexy celeb! pocketbabe.co.uk 4 more pics. 16 ï¿½3/wk <acct>,1,generic_spam,en,uci_spam
ok... c ya...,0,safe_generic,en,uci_spam
you have 1 new voicemail. please call <acct>,1,generic_spam,en,uci_spam
what he said is not the matter. my mind saying some other matter is there.,0,safe_generic,en,uci_spam
"al he does is moan at me if n e thin goes wrong its my fault&al de arguments r my fault&fed up of him of himso y bother? hav 2go, thanx.xx",0,safe_generic,en,uci_spam
neft transaction with reference number &lt;#&gt; for rs. &lt;decimal&gt; has been credited to the beneficiary account on &lt;#&gt; at &lt;time&gt; : &lt;#&gt;,0,safe_generic,en,uci_spam
otherwise had part time job na-tuition..,0,safe_generic,en,uci_spam
i know she called me,0,safe_generic,en,uci_spam
"me also da, i feel yesterday night wait til 2day night dear.",0,safe_generic,en,uci_spam
thanks for understanding. i've been trying to tell sura that.,0,safe_generic,en,uci_spam
win a year supply of cds 4 a store of ur choice worth ï¿½500 & enter our ï¿½100 weekly draw txt music to <otp> ts&cs <url>,1,generic_spam,en,uci_spam
the whole car appreciated the last two! dad and are having a map reading semi argument but apart from that things are going ok. p.,0,safe_generic,en,uci_spam
"as a sim subscriber, you are selected to receive a bonus! get it delivered to your door, txt the word ok to no: <otp> to claim. 150p/msg, exp. 30apr",1,generic_spam,en,uci_spam
i need you to be in my strong arms...,0,safe_generic,en,uci_spam
also maaaan are you missing out,0,safe_generic,en,uci_spam
his bday real is in april .,0,safe_generic,en,uci_spam
guessin you ain't gonna be here before 9?,0,safe_generic,en,uci_spam
ok then i will come to ur home after half an hour,0,safe_generic,en,uci_spam
"yo, the game almost over? want to go to walmart soon",0,safe_generic,en,uci_spam
"yeah, probably but not sure. ilol let u know, but personally i wuldnt bother, then again if ur goin to then i mite as well!!",0,safe_generic,en,uci_spam
i'll text now! all creepy like so he won't think that we forgot,0,safe_generic,en,uci_spam
"that would be good ï¿½ï¿½_ i'll phone you tomo lunchtime, shall i, to organise something?",0,safe_generic,en,uci_spam
you have 1 new voicemail. please call <acct>.,1,generic_spam,en,uci_spam
"damn, can you make it tonight or do you want to just wait til tomorrow",0,safe_generic,en,uci_spam
k..k..i'm also fine:)when will you complete the course?,0,safe_generic,en,uci_spam
"true. it is passable. and if you get a high score and apply for phd, you get 5years of salary. so it makes life easier.",0,safe_generic,en,uci_spam
no. 1 nokia tone 4 ur mob every week! just txt nok to <otp>. 1st tone free ! so get txtin now and tell ur friends. 150p/tone. 16 reply hl 4info,1,generic_spam,en,uci_spam
prakesh is there know.,0,safe_generic,en,uci_spam
teach me apps da. when you come to college.,0,safe_generic,en,uci_spam
rofl betta invest in some anti aging products,0,safe_generic,en,uci_spam
"sir, you will receive the account no another 1hr time. sorry for the delay.",0,safe_generic,en,uci_spam
reply with your name and address and you will receive by post a weeks completely free accommodation at various global locations <url> ph:<acct>p,1,generic_spam,en,uci_spam
so ï¿½_'ll be submitting da project tmr rite?,0,safe_generic,en,uci_spam
free entry into our ï¿½250 weekly comp just send the word enter to <otp> now. 18 t&c <url> cust care <acct>.,1,generic_spam,en,uci_spam
jus ans me lar. u'll noe later.,0,safe_generic,en,uci_spam
i want to send something that can sell fast. &lt;#&gt; k is not easy money.,0,safe_generic,en,uci_spam
have got * few things to do. may be in * pub later.,0,safe_generic,en,uci_spam
1's finish meeting call me.,0,safe_generic,en,uci_spam
lol ok. i'll snatch her purse too.,0,safe_generic,en,uci_spam
"\hello-/@drivby-:0quit edrunk sorry iff pthis makes no senrd-dnot no how ^ dancce 2 drum n basq!ihave fun 2nhite x ros xxxxxxx\""""",0,safe_generic,en,uci_spam
how much are we getting?,0,safe_generic,en,uci_spam
is ur paper in e morn or aft tmr?,0,safe_generic,en,uci_spam
"<name> westonzoyland, all going to plan this end too!",0,safe_generic,en,uci_spam
hope you are having a great new semester. do wish you the very best. you are made for greatness.,0,safe_generic,en,uci_spam
oh yes i can speak txt 2 u no! hmm. did u get email?,0,safe_generic,en,uci_spam
"i want to show you the world, princess :) how about europe?",0,safe_generic,en,uci_spam
nobody can decide where to eat and dad wants chinese,0,safe_generic,en,uci_spam
no shoot me. i'm in the docs waiting room. :/,0,safe_generic,en,uci_spam
now? i'm going out 4 dinner soon..,0,safe_generic,en,uci_spam
<name> site to download songs its urgent pls,0,safe_generic,en,uci_spam
"i do know what u mean, is the king of not havin credit! i'm goin2bed now. night night sweet! only1more sleep!",0,safe_generic,en,uci_spam
horrible gal. me in sch doing some stuff. how come u got mc?,0,safe_generic,en,uci_spam
"<name>! im not comin 2nite-tell every1 im sorry 4 me, hope u ava goodtime!oli rang melnite ifink it mite b sorted,but il explain everythin on mon.l<amount>x",0,safe_generic,en,uci_spam
please call <acct> immediately as there is an urgent message waiting for you,1,generic_spam,en,uci_spam
yeah like if it goes like it did with my friends imma flip my shit in like half an hour,0,safe_generic,en,uci_spam
mum say we wan to go then go... then she can shun bian watch da glass exhibition...,0,safe_generic,en,uci_spam
what your plan for pongal?,0,safe_generic,en,uci_spam
just wait till end of march when el nino gets himself. oh.,0,safe_generic,en,uci_spam
"not yet chikku..going to room nw, i'm in bus..",0,safe_generic,en,uci_spam
am also doing in cbe only. but have to pay.,0,safe_generic,en,uci_spam
honey boo i'm missing u.,0,safe_generic,en,uci_spam
"we have sent jd for customer service cum accounts executive to ur mail id, for details contact us",0,safe_generic,en,uci_spam
"yo, i'm at my parents' gettin cash. good news: we picked up a downstem",0,safe_generic,en,uci_spam
"thank you so much. when we skyped wit kz and sura, we didnt get the pleasure of your company. hope you are good. we've given you ultimatum oh! we are countin down to aburo. enjoy!",0,safe_generic,en,uci_spam
"hungry gay guys feeling hungry and up 4 it, now. call <acct> just 10p/min. to stop texts call <acct> (10p/min)",1,generic_spam,en,uci_spam
ok. no wahala. just remember that a friend in need ...,0,safe_generic,en,uci_spam
i will see in half an hour,0,safe_generic,en,uci_spam
"im in inperialmusic listening2the weirdest track ever byï¿½ï¿½leafcutter johnï¿½ï¿½-sounds like insects being molested&someone plumbing,remixed by evil men on acid!",0,safe_generic,en,uci_spam
\hey sorry i didntgive ya a a bellearlier hunny,0,safe_generic,en,uci_spam
seriously. tell her those exact words right now.,0,safe_generic,en,uci_spam
can u get 2 phone now? i wanna chat 2 set up meet call me now on <acct> u can cum here 2moro luv jane xx callsï¿½1/minmoremobsemspobox45po139wa,1,generic_spam,en,uci_spam
"tee hee. off to lecture, cheery bye bye.",0,safe_generic,en,uci_spam
"sorry chikku, my cell got some problem thts y i was nt able to reply u or msg u..",0,safe_generic,en,uci_spam
if you still havent collected the dough pls let me know so i can go to the place i sent it to get the control number,0,safe_generic,en,uci_spam
ok...,0,safe_generic,en,uci_spam
network operator. the service is free. for t & c's visit <otp>.biz,1,generic_spam,en,uci_spam
let me know how to contact you. i've you settled in a room. lets know you are ok.,0,safe_generic,en,uci_spam
wot u up 2 u weirdo?,0,safe_generic,en,uci_spam
can do lor...,0,safe_generic,en,uci_spam
dont put your phone on silent mode ok,0,safe_generic,en,uci_spam
can i meet ï¿½_ at 5.. as 4 where depends on where ï¿½_ wan 2 in lor..,0,safe_generic,en,uci_spam
waiting 4 my tv show 2 start lor... u leh still busy doing ur report?,0,safe_generic,en,uci_spam
oh ho. is this the first time u use these type of words,0,safe_generic,en,uci_spam
am i the only one who doesn't stalk profiles?,0,safe_generic,en,uci_spam
"ever green quote ever told by jerry in cartoon \a person who irritates u always is the one who loves u vry much but fails to express it...!..!! :-) :-) gud nyt""",0,safe_generic,en,uci_spam
yes i thought so. thanks.,0,safe_generic,en,uci_spam
but if she.s drinkin i'm ok.,0,safe_generic,en,uci_spam
"just wondering, the others just took off",0,safe_generic,en,uci_spam
"night has ended for another day, morning has come in a special way. may you smile like the sunny rays and leaves your worries at the blue blue bay. gud mrng",0,safe_generic,en,uci_spam
"what do you do, my dog ? must i always wait till the end of your day to have word from you ? did you run out of time on your cell already?",0,safe_generic,en,uci_spam
happy new year to u too!,0,safe_generic,en,uci_spam
"hey...great deal...farm tour 9am to 5pm $95/pax, $50 deposit by 16 may",0,safe_generic,en,uci_spam
eat jap done oso aft ur lect wat... ï¿½ï¿½ got lect at 12 rite...,0,safe_generic,en,uci_spam
"hey babe! i saw you came online for a second and then you disappeared, what happened ?",0,safe_generic,en,uci_spam
da my birthdate in certificate is in april but real date is today. but dont publish it. i shall give you a special treat if you keep the secret. any way thanks for the wishes,0,safe_generic,en,uci_spam
happy birthday... may all ur dreams come true...,0,safe_generic,en,uci_spam
aiyah u did ok already lar. e nydc at wheellock?,0,safe_generic,en,uci_spam
tell her i said eat shit.,0,safe_generic,en,uci_spam
sure! i am driving but will reach my destination soon.,0,safe_generic,en,uci_spam
"k so am i, how much for an 8th? fifty?",0,safe_generic,en,uci_spam
your daily text from me ï¿½ï¿½ï¿½ a favour this time,0,safe_generic,en,uci_spam
great to hear you are settling well. so what's happenin wit ola?,0,safe_generic,en,uci_spam
those cocksuckers. if it makes you feel better ipads are worthless garbage novelty items and you should feel bad for even wanting one,0,safe_generic,en,uci_spam
i tot u reach liao. he said t-shirt.,0,safe_generic,en,uci_spam
"fran i decided 2 go n e way im completely broke an knackered i got up bout 3 c u 2mrw love janx p.s this is my dads fone, -no credit",0,safe_generic,en,uci_spam
your right! i'll make the appointment right now.,0,safe_generic,en,uci_spam
designation is software developer and may be she get chennai:),0,safe_generic,en,uci_spam
enjoy the jamster videosound gold club with your credits for 2 new videosounds+2 logos+musicnews! get more fun from jamster.co.uk! 16+only help? call: <acct>,1,generic_spam,en,uci_spam
"get 3 lions england tone, reply lionm 4 mono or lionp 4 poly. 4 more go 2 <url> the original n best. tones 3gbp network operator rates apply",1,generic_spam,en,uci_spam
