text,label,category,lang,source
me hungry buy some food good lei... but mum n yun dun wan juz buy a little bit...,0,safe_generic,en,uci_spam
refused a loan? secured or unsecured? can't get credit? call free now <otp> 195 <otp> or text back 'help' & we will!,1,generic_spam,en,uci_spam
i probably won't eat at all today. i think i'm gonna pop. how was your weekend? did u miss me?,0,safe_generic,en,uci_spam
i knew it... u slept v late yest? wake up so late...,0,safe_generic,en,uci_spam
haha... dont be angry with yourself... take it as a practice for the real thing. =),0,safe_generic,en,uci_spam
where is that one day training:-),0,safe_generic,en,uci_spam
so i could kiss and feel you next to me...,0,safe_generic,en,uci_spam
have a nice day my dear.,0,safe_generic,en,uci_spam
i sent lanre fakeye's eckankar details to the mail box,0,safe_generic,en,uci_spam
your dad is back in ph?,0,safe_generic,en,uci_spam
"you have been specially selected to receive a \<otp> award! call <acct> before the lines close. cost 10ppm. 16+. t&cs apply. ag promo""",1,generic_spam,en,uci_spam
if you ask her or she say any please message.,0,safe_generic,en,uci_spam
"if e timing can, then i go w u lor...",0,safe_generic,en,uci_spam
i was just callin to say hi. take care bruv!,0,safe_generic,en,uci_spam
you have won! as a valued vodafone customer our computer has picked you to win a ï¿½150 prize. to collect is easy. just call <acct>,1,generic_spam,en,uci_spam
did u turn on the heater? the heater was on and set to &lt;#&gt; degrees.,0,safe_generic,en,uci_spam
thanks for your message. i really appreciate your sacrifice. i'm not sure of the process of direct pay but will find out on my way back from the test tomorrow. i'm in class now. do have a wonderful day.,0,safe_generic,en,uci_spam
"that's the trouble with classes that go well - you're due a dodgey one ï¿½ï¿½_ expecting mine tomo! see you for recovery, same time, same place",0,safe_generic,en,uci_spam
free video camera phones with half price line rental for 12 mths and 500 cross ntwk mins 100 txts. call mobileupd8 <acct> or call2optout/674&,1,generic_spam,en,uci_spam
wot u up 2 j?,0,safe_generic,en,uci_spam
"night night, see you tomorrow",0,safe_generic,en,uci_spam
roger that. weï¿½ï¿½ï¿½re probably going to rem in about 20,0,safe_generic,en,uci_spam
do u think that any girl will propose u today by seing ur bloody funky shit fucking face...............asssssholeeee................,0,safe_generic,en,uci_spam
i wish u were here. i feel so alone,0,safe_generic,en,uci_spam
reason is if the team budget is available at last they buy the unsold players for at base rate..,0,safe_generic,en,uci_spam
ceri u rebel! sweet dreamz me little buddy!! c ya 2moro! who needs blokes,0,safe_generic,en,uci_spam
ringtoneking <otp>,1,generic_spam,en,uci_spam
huh i cant thk of more oredi how many pages do we have?,0,safe_generic,en,uci_spam
his frens go then he in lor. not alone wif my mum n sis lor.,0,safe_generic,en,uci_spam
nationwide auto centre (or something like that) on newport road. i liked them there,0,safe_generic,en,uci_spam
"hey, i missed you tm of last night as my phone was on the charge ... *smiles* ... i am meeting a friend shortly",0,safe_generic,en,uci_spam
"whatever, juliana. do whatever you want.",0,safe_generic,en,uci_spam
ringtone club: gr8 new polys direct to your mobile every week !,1,generic_spam,en,uci_spam
"hello. sort of out in town already. that . so dont rush home, i am eating nachos. will let you know eta.",0,safe_generic,en,uci_spam
ok lor. anyway i thk we cant get tickets now cos like quite late already. u wan 2 go look 4 ur frens a not? darren is wif them now...,0,safe_generic,en,uci_spam
(bank of granite issues strong-buy) explosive pick for our members *****up over 300% *********** nasdaq symbol cdgt that is a $5.00 per..,1,generic_spam,en,uci_spam
"dizzamn, aight i'll ask my suitemates when i get back",0,safe_generic,en,uci_spam
"nimbomsons. yep phone knows that one. obviously, cos thats a real word",0,safe_generic,en,uci_spam
i love to cuddle! i want to hold you in my strong arms right now...,0,safe_generic,en,uci_spam
r u in this continent?,0,safe_generic,en,uci_spam
we'll you pay over like &lt;#&gt; yrs so its not too difficult,0,safe_generic,en,uci_spam
bored housewives! chat n date now! 08717<date>! bt-national rate 10p/min only from landlines!,1,generic_spam,en,uci_spam
we tried to call you re your reply to our sms for a video mobile 750 mins unlimited text free camcorder reply or call now <acct> del thurs,1,generic_spam,en,uci_spam
k...k...when will you give treat?,0,safe_generic,en,uci_spam
"this is the 2nd time we have tried to contact u. u have won the ï¿½400 prize. 2 claim is easy, just call <acct> now! only 10p per minute. bt-national-rate",1,generic_spam,en,uci_spam
he's just gonna worry for nothing. and he won't give you money its no use.,0,safe_generic,en,uci_spam
did you get any gift? this year i didnt get anything. so bad,0,safe_generic,en,uci_spam
well there's a pattern emerging of my friends telling me to drive up and come smoke with them and then telling me that i'm a weed fiend/make them smoke too much/impede their doing other things so you see how i'm hesitant,0,safe_generic,en,uci_spam
", ow u dey.i paid 60,400thousad.i told u would call .",0,safe_generic,en,uci_spam
im fine babes aint been up 2 much tho! saw scary movie yest its quite funny! want 2mrw afternoon? at town or mall or sumthin?xx,0,safe_generic,en,uci_spam
i'm reaching home in 5 min.,0,safe_generic,en,uci_spam
"forgot you were working today! wanna chat, but things are ok so drop me a text when you're free / bored etc and i'll ring. hope all is well, nose essay and all xx",0,safe_generic,en,uci_spam
ha... then we must walk to everywhere... cannot take tram. my cousin said can walk to vic market from our hotel,0,safe_generic,en,uci_spam
discussed with your mother ah?,0,safe_generic,en,uci_spam
"sorry, i can't text &amp; drive coherently, see you in twenty",0,safe_generic,en,uci_spam
you will be receiving this week's triple echo ringtone shortly. enjoy it!,1,generic_spam,en,uci_spam
in which place i can get rooms cheap:-),0,safe_generic,en,uci_spam
eek that's a lot of time especially since american pie is like 8 minutes long. i can't stop singing it.,0,safe_generic,en,uci_spam
"\gran onlyfound out afew days ago.cusoon honi\""""",0,safe_generic,en,uci_spam
"u've been selected to stay in 1 of 250 top british hotels - for nothing! holiday valued at ï¿½350! dial <acct> to claim - national rate call. bx526, sw73ss",1,generic_spam,en,uci_spam
university of southern california.,0,safe_generic,en,uci_spam
we have to pick rayan macleran there.,0,safe_generic,en,uci_spam
u gd lor go shopping i got stuff to do. u wan 2 watch infernal affairs a not? come lar...,0,safe_generic,en,uci_spam
well. balls. time to make calls,0,safe_generic,en,uci_spam
wat time ï¿½_ wan today?,0,safe_generic,en,uci_spam
&lt;#&gt; in mca. but not conform.,0,safe_generic,en,uci_spam
oh ok.. wat's ur email?,0,safe_generic,en,uci_spam
"yes, princess. are you going to make me moan?",0,safe_generic,en,uci_spam
lol its ok i didn't remember til last nite,0,safe_generic,en,uci_spam
"[ï¿½ï¿½_] anyway, many good evenings to u! s",0,safe_generic,en,uci_spam
"cool, i'll text you in a few",0,safe_generic,en,uci_spam
"sorry vikky, i'm watching olave mandara movie kano in trishul theatre wit my frnds..",0,safe_generic,en,uci_spam
i'm very happy for you babe ! woo hoo party on dude!,0,safe_generic,en,uci_spam
i am taking you for italian food. how about a pretty dress with no panties? :),0,safe_generic,en,uci_spam
wot u up 2? thout u were gonna call me!! txt bak luv k,0,safe_generic,en,uci_spam
you are chosen to receive a ï¿½350 award! pls call claim number <acct> to collect your award which you are selected to receive as a valued mobile customer.,1,generic_spam,en,uci_spam
how are you holding up?,0,safe_generic,en,uci_spam
dont flatter yourself... tell that man of mine two pints of carlin in ten minutes please....,0,safe_generic,en,uci_spam
hope you are not scared!,0,safe_generic,en,uci_spam
i'm at home n ready...,0,safe_generic,en,uci_spam
what time do u get out?,0,safe_generic,en,uci_spam
i am literally in bed and have been up for like &lt;#&gt; hours,0,safe_generic,en,uci_spam
"yes, my reg is ciao!",0,safe_generic,en,uci_spam
if you mean the website. yes.,0,safe_generic,en,uci_spam
win a ï¿½<otp> cash prize or a prize worth ï¿½<otp>,1,generic_spam,en,uci_spam
"thanks for your ringtone order, reference number x49.your mobile will be charged 4.50. should your tone not arrive please call customer services <acct>",1,generic_spam,en,uci_spam
lol or i could just starve and lose a pound by the end of the day.,0,safe_generic,en,uci_spam
yeah that's the impression i got,0,safe_generic,en,uci_spam
ok ok take care. i can understand.,0,safe_generic,en,uci_spam
"motivate behind every darkness, there is a shining light waiting for you to find it... behind every best friend, there is always trust and love... bslvyl",0,safe_generic,en,uci_spam
"ya ok, then had dinner?",0,safe_generic,en,uci_spam
i was slept that time.you there?,0,safe_generic,en,uci_spam
dont make ne plans for nxt wknd coz she wants us to come down then ok,0,safe_generic,en,uci_spam
when is school starting. where will you stay. what's the weather like. and the food. do you have a social support system like friends in the school. all these things are important.,0,safe_generic,en,uci_spam
"ha ha nan yalrigu heltini..iyo kot<name>, u shared many things wit me..so far i didn't told any body and even uttered a word abt u.. if ur trusting me so much how can i tell these to others.. plz nxt time dont use those words to me..ok, chikku:-);-)b-)",0,safe_generic,en,uci_spam
noice. text me when you're here,0,safe_generic,en,uci_spam
<name> yijue we're meeting at 7 pm at esaplanade tonight.,0,safe_generic,en,uci_spam
moby pub quiz.win a ï¿½100 high street prize if u know who the new duchess of cornwall will be? txt her first name to <otp>.unsub stop ï¿½1.50 <acct> sp,1,generic_spam,en,uci_spam
"this weeks savamob member offers are now accessible. just call <acct> for details! savamob, pobox 139, la3 2wu. only ï¿½1.50/week. savamob - offers mobile!",1,generic_spam,en,uci_spam
"aight i've been set free, think you could text me blake's address? it occurs to me i'm not quite as sure what i'm doing as i thought i was",0,safe_generic,en,uci_spam
<name> saw dear. we both are happy. where you my battery is low,0,safe_generic,en,uci_spam
how are you. its been ages. how's abj,0,safe_generic,en,uci_spam
prof: you have passed in all the papers in this sem congrats . . . . student: enna kalaachutaarama..!! prof:???? gud mrng!,0,safe_generic,en,uci_spam
dont kick coco when he's down,0,safe_generic,en,uci_spam
fyi i'm gonna call you sporadically starting at like &lt;#&gt; bc we are not not doin this shit,0,safe_generic,en,uci_spam
"you are being contacted by our dating service by someone you know! to find out who it is, call from your mobile or landline <acct> pobox75ldns7",1,generic_spam,en,uci_spam
tbs/persolvo. been chasing us since sept forï¿½38 definitely not paying now thanks to your information. we will ignore them. kath. manchester.,1,generic_spam,en,uci_spam
hope youï¿½ï¿½re not having too much fun without me!! see u tomorrow love jess x,0,safe_generic,en,uci_spam
ok i wont call or disturb any one. i know all are avoiding me. i am a burden for all,0,safe_generic,en,uci_spam
i've reached home n i bathe liao... u can call me now...,0,safe_generic,en,uci_spam
loans for any purpose even if you have bad credit! tenants welcome. call noworriesloans.com on <acct>,1,generic_spam,en,uci_spam
was the actual exam harder than nbme,0,safe_generic,en,uci_spam
a lot of this sickness thing going round. take it easy. hope u feel better soon. lol,0,safe_generic,en,uci_spam
<otp>: kick off a new season with 2wks free goals & news to ur mobile! txt ur club name to <otp> eg villa to <otp>,1,generic_spam,en,uci_spam
hey sathya till now we dint meet not even a single time then how can i saw the situation sathya.,0,safe_generic,en,uci_spam
gam gone after outstanding innings.,0,safe_generic,en,uci_spam
o i played smash bros &lt;#&gt; religiously.,0,safe_generic,en,uci_spam
"sir, good morning. hope you had a good weekend. i called to let you know that i was able to raise &lt;#&gt; from my dad. he however said he would make the rest available by mid feb. this amount is still quite short and i was hoping you would help. do have a good day. abiola",0,safe_generic,en,uci_spam
hurry home. soup is done!,0,safe_generic,en,uci_spam
"good afternoon, my love. it was good to see your words on ym and get your tm. very smart move, my slave ... *smiles* ... i drink my coffee and await you.",0,safe_generic,en,uci_spam
quite ok but a bit ex... u better go eat smth now else i'll feel guilty...,0,safe_generic,en,uci_spam
"orange brings you ringtones from all time chart heroes, with a free hit each week! go to ringtones & pics on wap. to stop receiving these tips reply stop.",1,generic_spam,en,uci_spam
lemme know when you're here,0,safe_generic,en,uci_spam
he needs to stop going to bed and make with the fucking dealing,0,safe_generic,en,uci_spam
"how are you, my love ? are you with your brother ? time to talk english with him ? *grins* say : hey muhommad, penny says <name> the sea",0,safe_generic,en,uci_spam
we tried to call you re your reply to our sms for a video mobile 750 mins unlimited text + free camcorder reply of call <acct> now,1,generic_spam,en,uci_spam
"hey doc pls i want to get nice t shirt for my hubby nice fiting ones my budget is &lt;#&gt; k help pls i will load d card abi hw,keep me posted luv. 2 mj",0,safe_generic,en,uci_spam
i remain unconvinced that this isn't an elaborate test of my willpower,0,safe_generic,en,uci_spam
"\life is nothing wen v get everything\"". but \""life is everything wen v miss something \"". real value of people wil be realized only in their absence.... gud mrng""",0,safe_generic,en,uci_spam
how are you? i miss you!,0,safe_generic,en,uci_spam
i ain't answerin no phone at what is actually a pretty reasonable hour but i'm sleepy,0,safe_generic,en,uci_spam
"hey , is * rite u put ï¿½ï¿½10 evey mnth is that all?",0,safe_generic,en,uci_spam
i am going to bed now prin,0,safe_generic,en,uci_spam
i think just yourself ï¿½ï¿½_thanks and see you tomo,0,safe_generic,en,uci_spam
if u dun drive then how i go 2 sch.,0,safe_generic,en,uci_spam
i not at home now lei...,0,safe_generic,en,uci_spam
gsoh? good with spam the ladies?u could b a male gigolo? 2 join the uk's fastest growing mens club reply oncall. mjzgroup. <acct>.2stop reply stop. msg@ï¿½1.50rcvd,1,generic_spam,en,uci_spam
do u hav any frnd by name ashwini in ur college?,0,safe_generic,en,uci_spam
jus finish my lunch on my way home lor... i tot u dun wan 2 stay in sch today...,0,safe_generic,en,uci_spam
k then 2marrow are you coming to class.,0,safe_generic,en,uci_spam
pls send me your address sir.,0,safe_generic,en,uci_spam
i want to lick your pussy now...,0,safe_generic,en,uci_spam
"yo, you gonna still be in stock tomorrow/today? i'm trying to get a dubsack",0,safe_generic,en,uci_spam
urgent! your mobile number has been awarded a <ukp><otp> prize guaranteed. call <acct> from landline. claim <otp>. valid 12hrs only 150ppm,1,generic_spam,en,uci_spam
"i'll see, but prolly yeah",0,safe_generic,en,uci_spam
thought we could go out for dinner. i'll treat you! seem ok?,0,safe_generic,en,uci_spam
where are you ? what do you do ? how can you stand to be away from me ? doesn't your heart ache without me ? don't you wonder of me ? don't you crave me ?,0,safe_generic,en,uci_spam
sorry. you never hear unless you book it. one was kinda a joke--thet were really looking for skinny white girls. the other was one line--you can only do so much on camera with that. something like that they're casting on the look.,0,safe_generic,en,uci_spam
"sure thing big man. i have hockey elections at 6, shouldnï¿½ï¿½ï¿½t go on longer than an hour though",0,safe_generic,en,uci_spam
watch lor. i saw a few swatch one i thk quite ok. ard 116 but i need 2nd opinion leh...,0,safe_generic,en,uci_spam
hiya do u like the hlday pics looked horrible in them so took mo out! hows the camp amrca thing? speak soon serena:),0,safe_generic,en,uci_spam
"babe! how goes that day ? what are you up to ? i miss you already, my love ... * loving kiss* ... i hope everything goes well.",0,safe_generic,en,uci_spam
yunny... i'm goin to be late,0,safe_generic,en,uci_spam
doc prescribed me morphine cause the other pain meds aren't enough. waiting for my mom to bring it. that med should kick in fast so i'm gonna try to be on later,0,safe_generic,en,uci_spam
"cool, want me to go to kappa or should i meet you outside mu",0,safe_generic,en,uci_spam
"hey sexy buns ! have i told you ? i adore you, loverboy. i hope you remember to thank your sister in law for those meatballs *grins* ... i love you, babe",0,safe_generic,en,uci_spam
may b approve panalam...but it should have more posts..,0,safe_generic,en,uci_spam
"spjanuary male sale! hot gay chat now cheaper, call <acct>. national rate from 1.5p/min cheap to 7.8p/min peak! to stop texts call <acct> (10p/min)",1,generic_spam,en,uci_spam
me i'm not workin. once i get job...,0,safe_generic,en,uci_spam
and by when you're done i mean now,0,safe_generic,en,uci_spam
\its ur luck to love someone. its ur fortune to love the one who loves u. but,0,safe_generic,en,uci_spam
<name> just got back from work and i was wanting to see u allday! i hope i didnt piss u off on the phone today. if u are up give me a call xxx,0,safe_generic,en,uci_spam
freemsg today's the day if you are ready! i'm horny & live in your town. i love sex fun & games! netcollex ltd <acct>p per msg reply stop to end,1,generic_spam,en,uci_spam
is it your yahoo boys that bring in the perf? or legal.,0,safe_generic,en,uci_spam
no need to say anything to me. i know i am an outsider,0,safe_generic,en,uci_spam
have you ever had one foot before?,0,safe_generic,en,uci_spam
just got to &lt;#&gt;,0,safe_generic,en,uci_spam
"good! no, donï¿½ï¿½ï¿½t need any receiptsï¿½ï¿½ï¿½well done! (ï¿½ï¿½_) yes, please tell . whatï¿½ï¿½ï¿½s her number, i could ring her",0,safe_generic,en,uci_spam
leave it wif me lar... ï¿½ï¿½ wan to carry meh so heavy... is da num 98321561 familiar to ï¿½_?,0,safe_generic,en,uci_spam
beautiful truth : expression of the face could be seen by everyone... but the depression of heart could be understood only by the loved ones.. gud ni8;-),0,safe_generic,en,uci_spam
infact happy new year. how are you where are you when are we seeing,0,safe_generic,en,uci_spam
"in the simpsons movie released in july <otp> name the band that died at the start of the film? a-green day, b-blue day, c-red day. (send a, b or c)",1,generic_spam,en,uci_spam
that's a shame! maybe cld meet for few hrs tomo?,0,safe_generic,en,uci_spam
lol i would but despite these cramps i like being a girl.,0,safe_generic,en,uci_spam
i canï¿½ï¿½t wait for cornwall. hope tonight isnï¿½ï¿½t too bad as well but itï¿½ï¿½s rock night shite. anyway iï¿½ï¿½m going for a kip now have a good night. speak to you soon.,0,safe_generic,en,uci_spam
pls help me tell sura that i'm expecting a battery from hont. and that if should pls send me a message about how to download movies. thanks,0,safe_generic,en,uci_spam
please call amanda with regard to renewing or upgrading your current t-mobile handset free of charge. offer ends today. tel <otp> 021 <otp> subject to t's and c's,1,generic_spam,en,uci_spam
"haven't found a way to get another app for your phone, eh ? will you go to the net cafe ? did you take that job? geeee i need you babe. i crave to see you ...",0,safe_generic,en,uci_spam
i only work from mon to thurs but sat i cant leh... booked liao... which other day u free?,0,safe_generic,en,uci_spam
ï¿½ï¿½ comin to fetch us oredi...,0,safe_generic,en,uci_spam
what's nannys address?,0,safe_generic,en,uci_spam
haf u eaten? wat time u wan me 2 come?,0,safe_generic,en,uci_spam
want a new video phone? 750 anytime any network mins? half price line rental free text for 3 months? reply or call <acct> for free delivery,1,generic_spam,en,uci_spam
"yo, call me when you get the chance, a friend of mine wanted me to ask you about a big order",0,safe_generic,en,uci_spam
this single single answers are we fighting? plus i said am broke and you didnt reply,0,safe_generic,en,uci_spam
it certainly puts things into perspective when something like this happens,0,safe_generic,en,uci_spam
now got tv 2 watch meh? u no work today?,0,safe_generic,en,uci_spam
i felt so...not any conveying reason.. ese he... what about me?,0,safe_generic,en,uci_spam
how's it going? got any exciting karaoke type activities planned? i'm debating whether to play football this eve. feeling lazy though.,0,safe_generic,en,uci_spam
i told that am coming on wednesday.,0,safe_generic,en,uci_spam
"its ok, called mom instead have fun",0,safe_generic,en,uci_spam
"<name>, to claim this weeks offer, at your pc please go to <url> ts&cs apply.",1,generic_spam,en,uci_spam
well if i'm that desperate i'll just call armand again,0,safe_generic,en,uci_spam
are you at work right now ?,0,safe_generic,en,uci_spam
haven't heard anything and he's not answering my texts so i'm guessing he flaked. that said the jb is fantastic,0,safe_generic,en,uci_spam
"mmmmmm ... i love you,so much, ahmad ... i can't wait for this year to begin as every second takes me closer to being at your side. happy new year, my love!!",0,safe_generic,en,uci_spam
pls what's the full name of joke's school cos fees in university of florida seem to actually be &lt;#&gt; k. pls holla back,0,safe_generic,en,uci_spam
ok... but they said i've got wisdom teeth hidden inside n mayb need 2 remove.,0,safe_generic,en,uci_spam
and pls pls drink plenty plenty water,0,safe_generic,en,uci_spam
how are you doing. how's the queen. are you going for the royal wedding,0,safe_generic,en,uci_spam
he's in lag. that's just the sad part but we keep in touch thanks to skype,0,safe_generic,en,uci_spam
ok lor then we go tog lor...,0,safe_generic,en,uci_spam
two teams waiting for some players,0,safe_generic,en,uci_spam
can ï¿½_ send me a copy of da report?,0,safe_generic,en,uci_spam
"swhrt how u dey,hope ur ok, tot about u 2day.love n miss.take care.",0,safe_generic,en,uci_spam
"ok da, i already planned. i wil pick you.",0,safe_generic,en,uci_spam
"urgent! please call <acct>. your abta complimentary 4* spanish holiday or ï¿½10,000 cash await collection sae t&cs box 47 po19 2ez 150ppm 18+",1,generic_spam,en,uci_spam
i just really need shit before tomorrow and i know you won't be awake before like 6,0,safe_generic,en,uci_spam
i'm good. have you registered to vote?,0,safe_generic,en,uci_spam
"hmm ok, i'll stay for like an hour cos my eye is really sore!",0,safe_generic,en,uci_spam
<name> directly to calicut,0,safe_generic,en,uci_spam
mm umma ask vava also to come tell him can play later together,0,safe_generic,en,uci_spam
"well the general price is &lt;#&gt; /oz, let me know if/when/how much you want",0,safe_generic,en,uci_spam
"each moment in a day,has its own value-morning brings hope,afternoon brings faith,evening brings luv,night brings rest,wish u find them all today.good morning",0,safe_generic,en,uci_spam
&lt;#&gt; w jetton ave if you forgot,0,safe_generic,en,uci_spam
ok i'm coming home now.,0,safe_generic,en,uci_spam
can not use foreign stamps in this country.,0,safe_generic,en,uci_spam
"sorry, it's a lot of friend-of-a-friend stuff, i'm just now about to talk to the actual guy who wants to buy",0,safe_generic,en,uci_spam
"cmon babe, make me horny, *turn* me on! txt me your fantasy now babe -) im hot, sticky and need you now. all replies cost ï¿½1.50. 2 cancel send stop",1,generic_spam,en,uci_spam
wylie update: my weed dealer carlos went to freedom and had a class with lunsford,0,safe_generic,en,uci_spam
are you happy baby ? are you alright ? did you take that job ? i hope your fine. i send you a kiss to make you smile from across the sea ... *kiss* *kiss*,0,safe_generic,en,uci_spam
c movie is juz last minute decision mah. juz watch 2 lar but i tot ï¿½_ not interested.,0,safe_generic,en,uci_spam
how are you enjoying this semester? take care brother.,0,safe_generic,en,uci_spam
important information 4 orange user <otp>xxxxxx. today is ur lucky day!2 find out why log onto <url> there's a fantastic prizeawaiting you!,1,generic_spam,en,uci_spam
"get the door, i'm here",0,safe_generic,en,uci_spam
"lets use it next week, princess :)",0,safe_generic,en,uci_spam
or i go home first lar ï¿½_ wait 4 me lor.. i put down my stuff first..,0,safe_generic,en,uci_spam
i want kfc its tuesday. only buy 2 meals only 2. no gravy. only 2 mark. 2!,0,safe_generic,en,uci_spam
no da:)he is stupid da..always sending like this:)don believe any of those message.pandy is a mental:),0,safe_generic,en,uci_spam
oi when you gonna ring,0,safe_generic,en,uci_spam
missed call alert. these numbers called but left no message. <acct>,1,generic_spam,en,uci_spam
i attended but nothing is there.,0,safe_generic,en,uci_spam
ard 530 like dat lor. we juz meet in mrt station then ï¿½_ dun haf to come out.,0,safe_generic,en,uci_spam
no dear i was sleeping :-p,0,safe_generic,en,uci_spam
er mw im filled tuth is aight,0,safe_generic,en,uci_spam
will be office around 4 pm. now i am going hospital.,0,safe_generic,en,uci_spam
actually i'm waiting for 2 weeks when they start putting ad.,0,safe_generic,en,uci_spam
anything lor if they all go then i go lor...,0,safe_generic,en,uci_spam
u free on sat rite? u wan 2 watch infernal affairs wif me n darren n mayb xy?,0,safe_generic,en,uci_spam
yo you around? a friend of mine's lookin to pick up later tonight,0,safe_generic,en,uci_spam
