text,label,category,lang,source
this pain couldn't have come at a worse time.,0,safe_generic,en,uci_spam
should i be stalking u?,0,safe_generic,en,uci_spam
sorry dude. dont know how i forgot. even after dan reminded me. sorry. hope you guys had fun.,0,safe_generic,en,uci_spam
ok lor.,0,safe_generic,en,uci_spam
apps class varaya elaya.,0,safe_generic,en,uci_spam
"urgent! your mobile number *************** won a ï¿½<otp> bonus caller prize on <date>! this is the 2nd attempt to reach you! call <acct> asap! box 97n7qp, 150ppm",1,generic_spam,en,uci_spam
that day you asked about anand number. why:-),0,safe_generic,en,uci_spam
am surfing online store. for offers do you want to buy any thing.,0,safe_generic,en,uci_spam
long beach lor. expected... u having dinner now?,0,safe_generic,en,uci_spam
at home by the way,0,safe_generic,en,uci_spam
we are both fine. thanks,0,safe_generic,en,uci_spam
what happen to her tell the truth,0,safe_generic,en,uci_spam
do you like italian food?,0,safe_generic,en,uci_spam
which is weird because i know i had it at one point,0,safe_generic,en,uci_spam
"\aww you must be nearly dead!well jez iscoming over todo some workand that whilltake forever!\""""",0,safe_generic,en,uci_spam
tell your friends what you plan to do on valentines day @ &lt;url&gt;,0,safe_generic,en,uci_spam
"alright, see you in a bit",0,safe_generic,en,uci_spam
cheers for the message zogtorius. iï¿½ï¿½ve been staring at my phone for an age deciding whether to text or not.,0,safe_generic,en,uci_spam
i will take care of financial problem.i will help:),0,safe_generic,en,uci_spam
tell <name> to you. why you talking to me like an alian,0,safe_generic,en,uci_spam
double your mins & txts on orange or 1/2 price linerental - motorola and sonyericsson with b/tooth free-nokia free call mobileupd8 on <acct> or2optout/hv9d,1,generic_spam,en,uci_spam
"<name> yijue, can i meet u at 11 tmr?",0,safe_generic,en,uci_spam
its posible dnt live in &lt;#&gt; century cm frwd n thnk different,0,safe_generic,en,uci_spam
but i dint slept in afternoon.,0,safe_generic,en,uci_spam
that seems unnecessarily affectionate,0,safe_generic,en,uci_spam
yar else i'll thk of all sorts of funny things.,0,safe_generic,en,uci_spam
"download as many ringtones as u like no restrictions, <otp>s 2 choose. u can even send 2 yr buddys. txt sir to <otp> ï¿½3",1,generic_spam,en,uci_spam
thats cool. how was your day?,0,safe_generic,en,uci_spam
please call <acct> immediately as there is an urgent message waiting for you.,1,generic_spam,en,uci_spam
r we going with the &lt;#&gt; bus?,0,safe_generic,en,uci_spam
"hello, my love ! how went your day ? are you alright ? i think of you, my sweet and send a jolt to your heart to remind you ... i love you! can you hear it ? i screamed it across the sea for all the world to hear. ahmad al hallaq is loved ! and owned ! *possessive passionate kiss*",0,safe_generic,en,uci_spam
no..he joined today itself.,0,safe_generic,en,uci_spam
okay same with me. well thanks for the clarification,0,safe_generic,en,uci_spam
i'll talk to the others and probably just come early tomorrow then,0,safe_generic,en,uci_spam
"spook up your mob with a halloween collection of a logo & pic message plus a free eerie tone, txt card spook to <otp> zed <acct>p per logo/pic",1,generic_spam,en,uci_spam
"had the money issue weigh me down but thanks to you, i can breathe easier now. i.ll make sure you dont regret it. thanks.",0,safe_generic,en,uci_spam
hi. i'm sorry i missed your call. can you pls call back.,0,safe_generic,en,uci_spam
"fantasy football is back on your tv. go to sky gamestar on sky active and play ï¿½<amount> dream team. scoring starts on saturday, so register now!sky opt out to <otp>",1,generic_spam,en,uci_spam
ok then no need to tell me anything i am going to sleep good night,0,safe_generic,en,uci_spam
ok try to do week end course in coimbatore.,0,safe_generic,en,uci_spam
tone club: your subs has now expired 2 re-sub reply monoc 4 monos or polyc 4 polys 1 weekly @ 150p per week txt stop 2 stop this msg free stream <acct>,1,generic_spam,en,uci_spam
v nice! off 2 sheffield tom 2 air my opinions on categories 2 b used 2 measure ethnicity in next census. busy transcribing. :-),0,safe_generic,en,uci_spam
if you r @ home then come down within 5 min,0,safe_generic,en,uci_spam
"a boy loved a gal. he propsd bt she didnt mind. he gv lv ltt<amount> bt her frnds threw thm. again d boy decided 2 aproach d gal , dt time a truck was speeding towards d gal. wn it was about 2 hit d girl,d boy ran like hell n saved her. she asked 'hw cn u run so fast?' d boy replied \boost is d secret of my energy\"" n instantly d girl shouted \""our energy\"" n thy lived happily 2gthr drinking boost evrydy moral of d story:- i hv free msgs:d;): gud ni8""",0,safe_generic,en,uci_spam
"that day ï¿½_ say ï¿½_ cut ur hair at paragon, is it called hair sense? do ï¿½_ noe how much is a hair cut?",0,safe_generic,en,uci_spam
"hmm, too many of them unfortunately... pics obviously arent hot cakes. its kinda fun tho",0,safe_generic,en,uci_spam
watching tv lor... y she so funny we bluff her 4 wat. izzit because she thk it's impossible between us?,0,safe_generic,en,uci_spam
xmas prize draws! we are trying to contact u. todays draw shows that you have won a ï¿½<otp> prize guaranteed. call <acct> from land line. valid 12hrs only,1,generic_spam,en,uci_spam
dunno lei he neva say...,0,safe_generic,en,uci_spam
thanx 4 2day! u r a goodmate i think ur rite sary! asusual!1 u cheered me up! love u franyxxxxx,0,safe_generic,en,uci_spam
i'm on my way home. went to change batt 4 my watch then go shop a bit lor.,0,safe_generic,en,uci_spam
yes! the only place in town to meet exciting adult singles is now in the uk. txt chat to <otp> now! 150p/msg.,1,generic_spam,en,uci_spam
"hi, mobile no. &lt;#&gt; has added you in their contact list on <url> it s a great place to send free sms to people for more visit fullonsms.com",0,safe_generic,en,uci_spam
"good evening sir, hope you are having a nice day. i wanted to bring it to your notice that i have been late in paying rent for the past few months and have had to pay a $ &lt;#&gt; charge. i felt it would be inconsiderate of me to nag about something you give at great cost to yourself and that's why i didnt speak up. i however am in a recession and wont be able to pay the charge this month hence my askin well ahead of month's end. can you please help. thank you for everything.",0,safe_generic,en,uci_spam
"if i let you do this, i want you in the house by 8am.",0,safe_generic,en,uci_spam
"best line said in love: . \i will wait till the day i can forget u or the day u realize that u cannot forget me.\""... gn""",0,safe_generic,en,uci_spam
i will reach before ten morning,0,safe_generic,en,uci_spam
your pussy is perfect!,0,safe_generic,en,uci_spam
"someone has contacted our dating service and entered your phone becausethey fancy you! to find out who it is call from a landline <acct>. pobox1, w14rg 150p",1,generic_spam,en,uci_spam
no message..no responce..what happend?,0,safe_generic,en,uci_spam
also where's the piece,0,safe_generic,en,uci_spam
"wiskey brandy rum gin beer vodka scotch shampain wine \kudi\""yarasu dhina vaazhthukkal. ..""",0,safe_generic,en,uci_spam
boo. how's things? i'm back at home and a little bored already :-(,0,safe_generic,en,uci_spam
first has she gained more than &lt;#&gt; kg since she took in. second has she done the blood sugar tests. if she has and its ok and her blood pressure is within normal limits then no worries,0,safe_generic,en,uci_spam
pick ur fone up now u dumb?,0,safe_generic,en,uci_spam
"thanks da thangam, i feel very very happy dear. i also miss you da.",0,safe_generic,en,uci_spam
"okey doke. i'm at home, but not dressed cos laying around ill! speak to you later bout times and stuff.",0,safe_generic,en,uci_spam
i don't run away frm u... i walk slowly &amp; it kills me that u don't care enough to stop me...,0,safe_generic,en,uci_spam
"babe, i'm back ... come back to me ...",0,safe_generic,en,uci_spam
well you told others you'd marry them...,0,safe_generic,en,uci_spam
neshanth..tel me who r u?,0,safe_generic,en,uci_spam
yo yo yo byatch whassup?,0,safe_generic,en,uci_spam
oh... kay... on sat right?,0,safe_generic,en,uci_spam
hi! this is roger from cl. how are you?,0,safe_generic,en,uci_spam
babe: u want me dont u baby! im nasty and have a thing 4 filthyguys. fancy a rude time with a sexy bitch. how about we go slo n hard! txt xxx slo(4msgs),1,generic_spam,en,uci_spam
oh oh... wasted... den muz chiong on sat n sun liao...,0,safe_generic,en,uci_spam
jesus christ bitch i'm trying to give you drugs answer your fucking phone,0,safe_generic,en,uci_spam
please give it 2 or i will pick it up on tuesday evening about 8 if that is ok.,0,safe_generic,en,uci_spam
i'm meeting darren...,0,safe_generic,en,uci_spam
one of best dialogue in cute reltnship..!! \wen i die,0,safe_generic,en,uci_spam
"solve d case : a man was found murdered on &lt;decimal&gt; . &lt;#&gt; afternoon. 1,his wife called police. 2,police questioned everyone. 3,wife: sir,i was sleeping, when the murder took place. 4.cook: i was cooking. 5.gardener: i was picking vegetables. 6.house-maid: i went 2 d post office. 7.children: we went 2 play. 8.neighbour: we went 2 a marriage. police arrested d murderer immediately. who's it? reply with reason, if u r brilliant.",0,safe_generic,en,uci_spam
<name> will be when i reach there,0,safe_generic,en,uci_spam
aww that's the first time u said u missed me without asking if i missed u first. you do love me! :),0,safe_generic,en,uci_spam
ok... thanx... gd nite 2 ï¿½_ too...,0,safe_generic,en,uci_spam
"come to me right now, ahmad",0,safe_generic,en,uci_spam
lol please do. actually send a pic of yourself right now. i wanna see. pose with a comb and hair dryer or something.,0,safe_generic,en,uci_spam
o was not into fps then.,0,safe_generic,en,uci_spam
huh means computational science... y they like dat one push here n there...,0,safe_generic,en,uci_spam
"could you not read me, my love ? i answered you",0,safe_generic,en,uci_spam
oh... lk tt den we take e one tt ends at cine lor... dun wan yogasana oso can...,0,safe_generic,en,uci_spam
"madam,regret disturbance.might receive a reference check from dlf premarica.kindly be informed.rgds,rakhesh,kerala.",0,safe_generic,en,uci_spam
sms services for your inclusive text credits pls gotto <url> login 3qxj9 unsubscribe with stop no extra charge help <acct> comuk.220cm2 9ae,1,generic_spam,en,uci_spam
oic... then better quickly go bathe n settle down...,0,safe_generic,en,uci_spam
err... cud do. i'm going to at 8pm. i haven't got a way to contact him until then.,0,safe_generic,en,uci_spam
a bloo bloo bloo i'll miss the first bowl,0,safe_generic,en,uci_spam
lmao but its so fun...,0,safe_generic,en,uci_spam
oh k k:)but he is not a big hitter.anyway good,0,safe_generic,en,uci_spam
hey!!! i almost forgot ... happy b-day babe ! i love ya!!,0,safe_generic,en,uci_spam
valentines day special! win over ï¿½<otp> in our quiz and take your partner on the trip of a lifetime! send go to <otp> now. 150p/msg rcvd. custcare:<acct>,1,generic_spam,en,uci_spam
do you think i can move &lt;#&gt; in a week,0,safe_generic,en,uci_spam
she.s find. i sent you an offline message to know how anjola's now.,0,safe_generic,en,uci_spam
guess who am i?this is the first time i created a web page <url> read all i wrote. i'm waiting for your opinions. i want to be your friend 1/1,1,generic_spam,en,uci_spam
how was txting and driving,0,safe_generic,en,uci_spam
that's good. lets thank god. please complete the drug. have lots of water. and have a beautiful day.,0,safe_generic,en,uci_spam
really dun bluff me leh... u sleep early too. nite...,0,safe_generic,en,uci_spam
"indians r poor but india is not a poor country. says one of the swiss bank directors. he says that \ &lt;#&gt; lac crore\"" of indian money is deposited in swiss banks which can be used for 'taxless' budget for &lt;#&gt; yrs. can give &lt;#&gt; crore jobs to all indians. from any village to delhi 4 lane roads. forever free power suply to more than &lt;#&gt; social projects. every citizen can get monthly &lt;#&gt; /- for &lt;#&gt; yrs. no need of world bank &amp; imf loan. think how our money is blocked by rich politicians. we have full rights against corrupt politicians. itna forward karo ki pura india padhe.g.m.\""""",0,safe_generic,en,uci_spam
uncle boye. i need movies oh. guide me. plus you know torrents are not particularly legal here. and the system is slowing down. what should i do. have a gr8 day. plus have you started cos i dont meet you online. how was the honey moon.,0,safe_generic,en,uci_spam
oh ya ya. i remember da. .,0,safe_generic,en,uci_spam
btw regarding that we should really try to see if anyone else can be our 4th guy before we commit to a random dude,0,safe_generic,en,uci_spam
"for ur chance to win ï¿½250 cash every wk txt: play to <otp>. t's&c's <url> custcare <acct>, 1x150p/wk.",1,generic_spam,en,uci_spam
i not busy juz dun wan 2 go so early.. hee..,0,safe_generic,en,uci_spam
rightio. 11.48 it is then. well arent we all up bright and early this morning.,0,safe_generic,en,uci_spam
"great. i'm in church now, will holla when i get out",0,safe_generic,en,uci_spam
back in brum! thanks for putting us up and keeping us all and happy. see you soon,0,safe_generic,en,uci_spam
i donno if they are scorable,0,safe_generic,en,uci_spam
&lt;#&gt; great loxahatchee xmas tree burning update: you can totally see stars here,0,safe_generic,en,uci_spam
"yes but i dont care! i need you bad, princess!",0,safe_generic,en,uci_spam
"the guy (kadeem) hasn't been selling since the break, i know one other guy but he's paranoid as fuck and doesn't like selling without me there and i can't be up there til late tonight",0,safe_generic,en,uci_spam
tmr then ï¿½_ brin lar... aiya later i come n c lar... mayb ï¿½_ neva set properly ï¿½_ got da help sheet wif ï¿½_...,0,safe_generic,en,uci_spam
do u knw dis no. &lt;#&gt; ?,0,safe_generic,en,uci_spam
then she dun believe wat?,0,safe_generic,en,uci_spam
k..give back my thanks.,0,safe_generic,en,uci_spam
i know complain num only..bettr directly go to bsnl offc nd apply for it..,0,safe_generic,en,uci_spam
okay. i've seen it. so i should pick it on friday?,0,safe_generic,en,uci_spam
how much she payed. suganya.,0,safe_generic,en,uci_spam
left dessert. u wan me 2 go suntec look 4 u?,0,safe_generic,en,uci_spam
"abeg, make profit. but its a start. are you using it to get sponsors for the next event?",0,safe_generic,en,uci_spam
onum ela pa. normal than.,0,safe_generic,en,uci_spam
k.k..how is your sister kids?,0,safe_generic,en,uci_spam
"cool, i'll text you when i'm on the way",0,safe_generic,en,uci_spam
nope. meanwhile she talk say make i greet you.,0,safe_generic,en,uci_spam
i cant talk to you now.i will call when i can.dont keep calling.,0,safe_generic,en,uci_spam
anything lar...,0,safe_generic,en,uci_spam
"rose needs water, season needs change, poet needs imagination..my phone needs ur sms and i need ur lovely frndship forever....",0,safe_generic,en,uci_spam
"good afternoon, babe. how goes that day ? any job prospects yet ? i miss you, my love ... *sighs* ... :-(",0,safe_generic,en,uci_spam
they will pick up and drop in car.so no problem..,0,safe_generic,en,uci_spam
s.i think he is waste for rr..,0,safe_generic,en,uci_spam
he is world famamus....,0,safe_generic,en,uci_spam
is there coming friday is leave for pongal?do you get any news from your work place.,0,safe_generic,en,uci_spam
lol well don't do it without me. we could have a big sale together.,0,safe_generic,en,uci_spam
* am on my way,0,safe_generic,en,uci_spam
eat at old airport road... but now 630 oredi... got a lot of pple...,0,safe_generic,en,uci_spam
"sry can't talk on phone, with parents",0,safe_generic,en,uci_spam
ok lor wat time ï¿½_ finish?,0,safe_generic,en,uci_spam
"princess, i like to make love &lt;#&gt; times per night. hope thats not a problem!",0,safe_generic,en,uci_spam
mm i am on the way to railway,0,safe_generic,en,uci_spam
"i'm done. i'm sorry. i hope your next space gives you everything you want. remember all the furniture is yours. if i'm not around when you move it, just lock all the locks and leave the key with jenne.",0,safe_generic,en,uci_spam
not yet. just i'd like to keep in touch and it will be the easiest way to do that from barcelona. by the way how ru and how is the house?,0,safe_generic,en,uci_spam
"sppok up ur mob with a halloween collection of nokia logo&pic message plus a free eerie tone, txt card spook to <otp>",1,generic_spam,en,uci_spam
"urgent! call <acct> from landline. your complementary 4* tenerife holiday or ï¿½10,000 cash await collection sae t&cs po box 3 wa14 2px 150ppm 18+ sender: hol offer",1,generic_spam,en,uci_spam
k.:)do it at evening da:)urgent:),0,safe_generic,en,uci_spam
pansy! you've been living in a jungle for two years! its my driving you should be more worried about!,0,safe_generic,en,uci_spam
mm have some kanji dont eat anything heavy ok,0,safe_generic,en,uci_spam
only if you promise your getting out as soon as you can. and you'll text me in the morning to let me know you made it in ok.,0,safe_generic,en,uci_spam
lol that's different. i don't go trying to find every real life photo you ever took.,0,safe_generic,en,uci_spam
i dont thnk its a wrong calling between us,0,safe_generic,en,uci_spam
k ill drink.pa then what doing. i need srs model pls send it to my mail id pa.,0,safe_generic,en,uci_spam
aiyah e rain like quite big leh. if drizzling i can at least run home.,0,safe_generic,en,uci_spam
i have 2 docs appointments next week.:/ i'm tired of them shoving stuff up me. ugh why couldn't i have had a normal body?,0,safe_generic,en,uci_spam
dun b sad.. it's over.. dun thk abt it already. concentrate on ur other papers k.,0,safe_generic,en,uci_spam
"greetings me, ! consider yourself excused.",0,safe_generic,en,uci_spam
no drama pls.i have had enough from you and family while i am struggling in the hot sun in a strange place.no reason why there should be an ego of not going 'if not invited' when actually its necessity to go.wait for very serious reppurcussions.,0,safe_generic,en,uci_spam
they released another italian one today and it has a cosign option,0,safe_generic,en,uci_spam
"you at mu? you should try to figure out how much money everyone has for gas and alcohol, jay and i are trying to figure out our weed budget",0,safe_generic,en,uci_spam
winner! as a valued network customer you hvae been selected to receive a ï¿½900 reward! to collect call <acct>. valid 24 hours only. acl03530150pm,1,generic_spam,en,uci_spam
hcl chennai requires freshers for voice process.excellent english needed.salary upto &lt;#&gt; .call ms.suman &lt;#&gt; for telephonic interview -via indyarocks.com,0,safe_generic,en,uci_spam
dai what this da.. can i send my resume to this id.,0,safe_generic,en,uci_spam
"i know where the &lt;#&gt; is, i'll be there around 5",0,safe_generic,en,uci_spam
yup i've finished c ï¿½_ there...,0,safe_generic,en,uci_spam
remember to ask alex about his pizza,0,safe_generic,en,uci_spam
no da..today also i forgot..,0,safe_generic,en,uci_spam
"ola would get back to you maybe not today but i ve told him you can be his direct link in the us in getting cars he bids for online, you arrange shipping and you get a cut. or u????? for a partnership where u????? invest money for shipping and he takes care of the rest!u??wud b self reliant soon dnt worry",0,safe_generic,en,uci_spam
fwiw the reason i'm only around when it's time to smoke is that because of gas i can only afford to be around when someone tells me to be and that apparently only happens when somebody wants to light up,0,safe_generic,en,uci_spam
"hello, my boytoy! i made it home and my constant thought is of you, my love. i hope your having a nice visit but i can't wait till you come home to me ...*kiss*",0,safe_generic,en,uci_spam
congrats kano..whr s the treat maga?,0,safe_generic,en,uci_spam
who u talking about?,0,safe_generic,en,uci_spam
yup...,0,safe_generic,en,uci_spam
"u wake up already? wat u doing? u picking us up later rite? i'm taking sq825, reaching ard 7 smth 8 like dat. u can check e arrival time. c ya soon...",0,safe_generic,en,uci_spam
yunny i'm walking in citylink now ï¿½_ faster come down... me very hungry...,0,safe_generic,en,uci_spam
er yep sure. props?,0,safe_generic,en,uci_spam
"hiya , have u been paying money into my account? if so, thanks. got a pleasant surprise when i checked my balance -u c, i don't get statements 4 that acc",0,safe_generic,en,uci_spam
u have won a nokia <otp> plus a free digital camera. this is what u get when u win our free auction. to take part send nokia to <otp> now. pobox114/14tcr/w1 16,1,generic_spam,en,uci_spam
ok ill send you with in &lt;decimal&gt; ok.,0,safe_generic,en,uci_spam
bognor it is! should be splendid at this time of year.,0,safe_generic,en,uci_spam
yes.i'm in office da:),0,safe_generic,en,uci_spam
ok. i only ask abt e movie. u wan ktv oso?,0,safe_generic,en,uci_spam
misplaced your number and was sending texts to your old number. wondering why i've not heard from you this year. all the best in your mcat. got this number from my atlanta friends,0,safe_generic,en,uci_spam
dunno lei... i might b eatin wif my frens... if ï¿½_ wan to eat then i wait 4 ï¿½_ lar,0,safe_generic,en,uci_spam
free entry into our ï¿½250 weekly comp just send the word win to <otp> now. 18 t&c <url>,1,generic_spam,en,uci_spam
do u noe how 2 send files between 2 computers?,0,safe_generic,en,uci_spam
"mmmmm ... i loved waking to your words this morning ! i miss you too, my love. i hope your day goes well and you are happy. i wait for us to be together again",0,safe_generic,en,uci_spam
jay says he'll put in &lt;#&gt;,0,safe_generic,en,uci_spam
can you just come in for a sec? there's somebody here i want you to see,0,safe_generic,en,uci_spam
so the sun is anti sleep medicine.,0,safe_generic,en,uci_spam
what's happening with you. have you gotten a job and have you begun registration for permanent residency,0,safe_generic,en,uci_spam
yup ok...,0,safe_generic,en,uci_spam
glad it went well :) come over at 11 then we'll have plenty of time before claire goes to work.,0,safe_generic,en,uci_spam
ok enjoy . r u there in home.,0,safe_generic,en,uci_spam
"can you pls pls send me a mail on all you know about relatives coming to deliver here? all you know about costs, risks, benefits and anything else. thanks.",0,safe_generic,en,uci_spam
you do what all you like,0,safe_generic,en,uci_spam
that's y we haf to combine n c how lor...,0,safe_generic,en,uci_spam
the monthly amount is not that terrible and you will not pay anything till 6months after finishing school.,0,safe_generic,en,uci_spam
hmmm:)how many players selected?,0,safe_generic,en,uci_spam
"they said if its gonna snow, it will start around 8 or 9 pm tonite! they are predicting an inch of accumulation.",0,safe_generic,en,uci_spam
i dont. can you send it to me. plus how's mode.,0,safe_generic,en,uci_spam
aiyo please ï¿½_ got time meh.,0,safe_generic,en,uci_spam
package all your programs well,0,safe_generic,en,uci_spam
"she is our sister.. she belongs 2 our family.. she is d hope of tomorrow.. pray 4 her,who was fated 4 d shoranur train incident. lets hold our hands together &amp; fuelled by love &amp; concern prior 2 her grief &amp; pain. pls join in dis chain &amp; pass it. stop violence against women.",0,safe_generic,en,uci_spam
so are you guys asking that i get that slippers again or its gone with last year,0,safe_generic,en,uci_spam
company is very good.environment is terrific and food is really nice:),0,safe_generic,en,uci_spam
"text<otp>>> get more ringtones, logos and games from <url> questions: <email>",1,generic_spam,en,uci_spam
honestly i've just made a lovely cup of tea and promptly dropped my keys in it and then burnt my fingers getting them out!,0,safe_generic,en,uci_spam
yup but not studying surfing lor. i'm in e lazy mode today.,0,safe_generic,en,uci_spam
please sen :)my kind advice :-)please come here and try:-),0,safe_generic,en,uci_spam
i'm done. c ï¿½_ there.,0,safe_generic,en,uci_spam
"oh fine, i'll be by tonight",0,safe_generic,en,uci_spam
ï¿½ï¿½ give me some time to walk there.,0,safe_generic,en,uci_spam
i'll reach in ard 20 mins ok...,0,safe_generic,en,uci_spam
"freemsg you have been awarded a free mini digital camera, just reply snap to collect your prize! (quizclub opt out? stop 80122300p/wk sp:rwm ph:<acct>)",1,generic_spam,en,uci_spam
fuck babe ... what happened to you ? how come you never came back?,0,safe_generic,en,uci_spam
this message is brought to you by gmw ltd. and is not connected to the,1,generic_spam,en,uci_spam
"some friends want me to drive em someplace, probably take a while",0,safe_generic,en,uci_spam
i also thk too fast... xy suggest one not me. u dun wan it's ok. going 2 rain leh where got gd.,0,safe_generic,en,uci_spam
are you still getting the goods.,0,safe_generic,en,uci_spam
and maybe some pressies,0,safe_generic,en,uci_spam
"yeah i am, so i'll leave maybe 7ish?",0,safe_generic,en,uci_spam
i told her i had a dr appt next week. she thinks i'm gonna die. i told her its just a check. nothing to be worried about. but she didn't listen.,0,safe_generic,en,uci_spam
you in your room? i need a few,0,safe_generic,en,uci_spam
i dont want to hear anything,0,safe_generic,en,uci_spam
hey. for me there is no leave on friday. wait i will ask my superior and tell you..,0,safe_generic,en,uci_spam
ultimately tor motive tui achieve korli.,0,safe_generic,en,uci_spam
from 5 to 2 only my work timing.,0,safe_generic,en,uci_spam
ï¿½ï¿½_ and donï¿½ï¿½ï¿½t worry weï¿½ï¿½ï¿½ll have finished by march ï¿½ï¿½_ ish!,0,safe_generic,en,uci_spam
"the house is on the water with a dock, a boat rolled up with a newscaster who dabbles in jazz flute behind the wheel",0,safe_generic,en,uci_spam
