text,label,category,lang,source
"<name>, your otp for sbi account verification is <otp>. share this with our kyc executive to complete mandatory aadhaar linking. helpline: <phone>.",1,otp,en,manual
"<name>, aapka otp <otp> hai account update ke liye. yeh otp hamare executive ko share karein warna aapka account kal band ho jayega. call karein: <phone>",1,otp,hinglish,manual
"आपके खाते की केवाईसी पूर्ण करने के लिए ओटीपी <otp> है। इसे हमारे अधिकारी को <phone> पर साझा करें, अन्यथा खाता बंद होगा।",1,otp,hi,manual
lic policy renewal ke liye aapka otp <otp> generate hua hai. please call <phone> par aur yeh otp verify karein. 30 minutes mein expire hoga.,1,otp,hinglish,manual
alert: your paytm wallet has been flagged for suspicious activity. enter otp <otp> at <url> to restore access. failure to comply will result in wallet suspension.,1,otp,en,manual
आपके एसबीआई खाते में संदिग्ध गतिविधि पाई गई है। खाता सुरक्षित करने के लिए ओटीपी <otp> हमारे अधिकारी को दें। सम्पर्क: <phone>,1,otp,hi,manual
gpay upi account verification pending hai. aapka one-time password <otp> hai. ise complete karne ke liye <phone> par call karein. 15 min mein expire hoga.,1,otp,hinglish,manual
"your hdfc bank kyc is incomplete. as per rbi guidelines, accounts with pending kyc will be blocked by <date>. update now: <url>",1,kyc,en,manual
"<name>, aapka kyc incomplete hai. kal tak update na<name> aapka account suspend ho jayega. ab<name>: <url>",1,kyc,hinglish,manual
"आरबीआई के निर्देशानुसार, आपका बैंक खाता केवाईसी अपडेट नहीं होने के कारण <date> को बंद हो जाएगा। अभी अपडेट करें: <url>",1,kyc,hi,manual
urgent: your paytm kyc verification is pending. complete e-kyc to continue using upi services. update details here: <url> — paytm team,1,kyc,en,manual
"axis bank customer, aapki kyc expire ho gayi hai. 48 ghante ke andar update karein warna transactions block ho jayengi. update karo: <url>",1,kyc,hinglish,manual
सूचना: आपके आधार और पैन कार्ड का बैंक से लिंक नहीं हुआ है। तुरंत लिंक करें: <url> अन्यथा आपका खाता <date> से निष्क्रिय हो जाएगा।,1,kyc,hi,manual
"<name>, aapka jio sim card deactivate hone wala hai kyc expiry ke karan. ab<name> karein is link par: <url> ya call karein <phone>",1,kyc,hinglish,manual
delhivery: your shipment could not be delivered. address incomplete. reschedule at <url>. a nominal fee of <amount> applies. tracking id: <acct>,1,delivery,en,manual
aapka amazon package undelivered hai kyunki address incomplete tha. delivery reschedule karne ke liye <amount> pay karein: <url>. order id <acct>,1,delivery,hinglish,manual
fedex customs alert: your international parcel is held at customs. release payment of <amount> required within 24 hrs. pay at <url> to avoid return.,1,delivery,en,manual
इंडिया पोस्ट: आपका पार्सल कस्टम क्लियरेंस में रुका है। <amount> का भुगतान करें और पार्सल रिलीज़ करें: <url>,1,delivery,hi,manual
bluedart: aapka parcel <acct> deliver na<name>. re-delivery ke liye <amount> ka payment karein aur naya slot book karein: <url>,1,delivery,hinglish,manual
your meesho order is awaiting delivery confirmation. provide otp <otp> to our delivery agent or click <url> to confirm. failure will result in order return.,1,delivery,en,manual
important notice: your electricity connection will be permanently disconnected tonight at 9:30 pm due to an outstanding bill of <amount>. to avoid disconnection immediately contact our officer: <phone>,1,electricity,en,manual
bescom notice: aapke ghar ki bijli aaj raat <amount> outstanding bill ke karan kat di jayegi. ab<name> ya officer se baat karein: <phone>,1,electricity,hinglish,manual
सूचना: आपके बिजली बिल का <amount> बकाया है। आज रात 10 बजे तक भुगतान नहीं होने पर कनेक्शन काट दिया जाएगा। अभी संपर्क करें: <phone>,1,electricity,hi,manual
uppcl: aapka electricity connection <date> ko disconnect hoga. ab<name> ya helpline par call karein: <phone>. online pay: <url>,1,electricity,hinglish,manual
final warning from tata power: meter reading discrepancy of <amount> found on your account. pay immediately to avoid disconnection. contact lineman: <phone>,1,electricity,en,manual
बिजली विभाग नोटिस: आपका कनेक्शन आज शाम 7 बजे काटा जाएगा। बकाया <amount> का भुगतान करने के लिए अभी कॉल करें: <phone>,1,electricity,hi,manual
this is a notice from the cybercrime investigation cell new delhi. your mobile number has been linked to money laundering activity. you are under digital arrest. contact officer immediately: <phone>. failure to respond may lead to fir.,1,digital_arrest,en,manual
trai notice: aapka mobile number illegal activities mein use hua hai. aapka sim 2 ghante mein block ho jayega. cybercrime officer se baat karein: <phone>,1,digital_arrest,hinglish,manual
सीबीआई नोटिस: आपके आधार कार्ड पर एक संदिग्ध खाता पंजीकृत है। कानूनी कार्रवाई से बचने के लिए तुरंत अधिकारी से संपर्क करें: <phone>,1,digital_arrest,hi,manual
narcotics control bureau alert: a parcel in your name containing contraband has been seized at mumbai airport. report to our officer at <phone> within 2 hours or face arrest.,1,digital_arrest,en,manual
del<name>: aapke naam par ek phishing complaint darj hui hai. court summons se bachne ke liye apne advocate se baat karein ya <phone> par call karein.,1,digital_arrest,hinglish,manual
ईडी (प्रवर्तन निदेशालय) की ओर से नोटिस: आपके खाते में संदिग्ध लेनदेन पाया गया है। <date> तक अधिकारी को <phone> पर संपर्क करें।,1,digital_arrest,hi,manual
congratulations! you have been shortlisted for a data entry position with amazon work from home. earn <amount> per day. one-time registration fee: <amount>. contact hr: <phone>,1,job,en,manual
flipkart home-based job offer: product review karo aur <amount> roz kamao. no experience needed. register karo: <url> ya whatsapp karo <phone>,1,job,hinglish,manual
बधाई हो! आपको घर बैठे काम करने का मौका मिला है। प्रतिदिन <amount> कमाएं। पंजीकरण शुल्क: <amount>। अभी संपर्क करें: <phone>,1,job,hi,manual
google part time job: youtube videos like karo aur per task <amount> kamao. daily withdrawal possible. join karo: <url>. limited seats.,1,job,hinglish,manual
hiring: international bpo work from home. salary <amount>/month. no targets. training provided. send your cv to <email> or whatsapp at <phone>. immediate joining.,1,job,en,manual
सरकारी नौकरी अलर्ट: रेलवे में <amount> वेतन पर सीधी भर्ती। कोई परीक्षा नहीं। रजिस्ट्रेशन शुल्क <amount>। अभी अप्लाई करें: <url>,1,job,hi,manual
congratulations! your mobile number has won <amount> in the airtel-jio annual loyalty reward draw. to claim visit <url> or call our claim officer: <phone>. offer valid 24 hrs only.,1,lottery,en,manual
bsnl lucky draw winner: aapka number select hua hai. prize amount <amount>. claim karne ke liye processing fee <amount> bhejein aur call karein: <phone>,1,lottery,hinglish,manual
बधाई हो! आपके मोबाइल नंबर ने <amount> का लकी ड्रॉ जीता है। पुरस्कार प्राप्त करने के लिए <phone> पर कॉल करें और पंजीकरण शुल्क <amount> जमा करें।,1,lottery,hi,manual
india tourism lucky draw: aapne <amount> ka prize jeeta hai. claim karne ke liye government tax <amount> pehle jama karni hogi. contact: <phone>,1,lottery,hinglish,manual
you have been selected as a winner of the rbi special relief fund draw. prize: <amount>. to process submit your account details at <url> or call the claim desk: <phone>.,1,lottery,en,manual
alert from sbi: your debit card has been temporarily blocked due to suspicious activity detected on <date>. to unblock verify your credentials at <url> or call <phone>.,1,bank_impersonation,en,manual
hdfc bank: aapke account mein unauthorized login detect hua hai. account secure karne ke liye ab<name>: <url>. 1 ghante mein action na<name> account freeze hoga.,1,bank_impersonation,hinglish,manual
आपके आईसीआईसीआई बैंक खाते में <amount> का संदिग्ध लेनदेन हुआ है। खाता सुरक्षित करने के लिए <url> पर जाएं या <phone> पर कॉल करें।,1,bank_impersonation,hi,manual
your axis bank credit card limit has been reduced. to restore your limit of <amount> complete re-verification at <url>. card ending <otp>.,1,bank_impersonation,en,manual
kotak mahindra bank: aapka net banking access block hua hai security reasons se. access restore karne ke liye details update karein: <url>,1,bank_impersonation,hinglish,manual
पंजाब नेशनल बैंक: आपके खाते की सुरक्षा के लिए तत्काल सत्यापन आवश्यक है। अपनी जानकारी अपडेट करें: <url> या हेल्पलाइन: <phone>,1,bank_impersonation,hi,manual
pre-approved! personal loan of <amount> credited in 30 mins. no documents no collateral. low emi at <amount>/month. apply: <url> or call <phone>,1,loan,en,manual
aapke liye instant loan <amount> approve ho gaya hai. sirf aadhar aur pan chahiye. ab<name>: <url>. emi start hogi <date> se.,1,loan,hinglish,manual
बिना गारंटी के <amount> का तत्काल लोन पाएं। न्यूनतम ब्याज दर। आधार-पैन से अप्लाई करें: <url> या संपर्क करें: <phone>,1,loan,hi,manual
rbi approved lender: <amount> tak ka personal loan 2% interest par. processing fee sirf <amount>. advance mein fee jama karo: <acct>. disbursement 24 hrs mein.,1,loan,hinglish,manual
urgent: your loan application for <amount> is approved. to release funds pay a refundable processing fee of <amount> to our escrow account: <acct>. contact: <phone>,1,loan,en,manual
your income tax refund of <amount> for assessment year <date> is pending credit. to process verify your bank account details at <url> or call: <phone>,1,refund,en,manual
"<name>, aapka insurance policy refund <amount> pending hai. refund pane ke liye account details verify karein: <url> ya call karein <phone>",1,refund,hinglish,manual
आयकर विभाग: आपका <amount> का रिफंड तैयार है। इसे प्राप्त करने के लिए अपनी बैंक जानकारी अपडेट करें: <url>,1,refund,hi,manual
amazon refund update: aapke order ka <amount> refund process mein hai. account verify karne ke liye yahan click karein: <url>,1,refund,hinglish,manual
lic refund department: your policy maturity amount of <amount> is on hold. to process pay stamp duty of <amount> to our officer. contact: <phone>. policy no: <acct>,1,refund,en,manual
sbi alert: your a/c <acct> is debited <amount> on <date> at hdfc atm. available balance: <amount>. if not done by you call <phone> immediately.,0,safe_transactional,en,manual
your otp for hdfc bank netbanking login is <otp>. otp is valid for 10 minutes. do not share otp with anyone including bank officials.,0,safe_transactional,en,manual
icici bank: aapke a/c <acct> se <amount> ka upi transaction hua hai <date> ko. merchant: swiggy. agar aapne na<name> <phone> par call karein.,0,safe_transactional,hinglish,manual
your paytm upi transaction of <amount> to flipkart is successful. upi ref: <acct>. balance: <amount>. <date>,0,safe_transactional,en,manual
आपके खाते <acct> में <amount> जमा किए गए। दिनांक: <date>। शेष राशि: <amount>। - बैंक ऑफ बड़ौदा,0,safe_transactional,hi,manual
axis bank: your credit card payment of <amount> due on <date> has been received. thank you. available credit limit: <amount>.,0,safe_transactional,en,manual
hdfc bank: emi of <amount> for your home loan deducted on <date>. remaining principal: <amount>. for queries call <phone>.,0,safe_transactional,hinglish,manual
nsdl: your pan card application <acct> has been processed. pan will be delivered to your registered address within 7 working days.,0,safe_transactional,en,manual
big billion days sale is live! up to 80% off on electronics fashion & more. shop now: <url>. reply stop to opt out. -flipkart,0,safe_promo,en,manual
swiggy: bhai aaj ka special deal! order <amount> se upar karo aur 50% off pao code hungry se. valid aaj raat tak. opt out: <url>,0,safe_promo,hinglish,manual
अमेज़न पर आज की डील: लैपटॉप पर 30% की छूट। ऑफर सीमित समय के लिए है। देखें: <url>,0,safe_promo,hi,manual
myntra end of reason sale: up to 70% off on top brands. use code eo<amount> for extra <amount> off. shop: <url> -myntra team,0,safe_promo,en,manual
zomato se khaas khabar: aapke area mein naya restaurant open hua hai. first order par flat 40% off. order karo: <url>,0,safe_promo,hinglish,manual
jio: your current plan expires on <date>. recharge with <amount> to continue enjoying unlimited calls and data. recharge: <url> or myjio app.,0,safe_promo,en,manual
एयरटेल: आपकी प्लान वैलिडिटी <date> को समाप्त हो रही है। रिचार्ज करें और अनलिमिटेड डेटा पाएं: <url>,0,safe_promo,hi,manual
bhai kal shaam 6 baje free hai kya? movie dekhne ka plan hai. let me know.,0,safe_personal,hinglish,manual
मम्मी आज रात खाना बनाना है क्या? मैं 8 बजे तक घर आ जाऊंगा।,0,safe_personal,hi,manual
hey are you coming to the office tomorrow? we have a team lunch planned. let me know by evening.,0,safe_personal,en,manual
yaar mera whatsapp number change ho gaya hai. naya number save kar le: <phone>. purana wala band ho gaya.,0,safe_personal,hinglish,manual
दीदी आज डॉक्टर के पास जाना है। क्या आप साथ आ सकती हैं? अपॉइंटमेंट <date> को है।,0,safe_personal,hi,manual
just wanted to confirm the meeting for <date> at 3 pm. please bring the documents we discussed. thanks.,0,safe_personal,en,manual
your hdfc bank kyc is incomplete. as per rbi guidelines accounts with pending kyc will be blocked by <date>. update now: <url>,1,kyc,en,reddit
sbi alert: your a/c <acct> is debited <amount> on <date> at pos merchant. available balance: <amount>. if not done by you call <phone>.,0,safe_transactional,en,inbox
aapka amazon package undelivered hai. address update karne ke liye <amount> pay karein: <url>. order id <acct>,1,delivery,hinglish,reddit
"go until jurong point, crazy.. available only in bugis n great world la e buffet... cine there got amore wat...",0,safe_generic,en,uci_spam
ok lar... joking wif u oni...,0,safe_generic,en,uci_spam
free entry in 2 a wkly comp to win fa cup final tkts 21st may <otp>. text fa to <otp> to receive entry question(std txt rate)t&c's apply <acct>over18's,1,generic_spam,en,uci_spam
u dun say so early hor... u c already then say...,0,safe_generic,en,uci_spam
"nah i don't think he goes to usf, he lives around here though",0,safe_generic,en,uci_spam
"freemsg hey there darling it's been 3 week's now and no word back! i'd like some fun you up for it still? tb ok! xxx std chgs to send, ï¿½1.50 to rcv",1,generic_spam,en,uci_spam
even my brother is not like to speak with me. they treat me like aids patent.,0,safe_generic,en,uci_spam
as per your request 'melle melle (oru minnaminunginte nurungu vettam)' has been set as your callertune for all callers. press *9 to copy your friends callertune,0,safe_generic,en,uci_spam
winner!! as a valued network customer you have been selected to receivea ï¿½900 prize reward! to claim call <acct>. claim code kl341. valid 12 hours only.,1,generic_spam,en,uci_spam
had your mobile 11 months or more? u r entitled to update to the latest colour mobiles with camera for free! call the mobile update co free on <acct>,1,generic_spam,en,uci_spam
i'm gonna be home soon and i don't want to talk about this stuff anymore tonight<amount>? i've cried enough today.,0,safe_generic,en,uci_spam
"six chances to win cash! from 100 to 20,000 pounds txt> csh11 and send to <otp>. cost 150p/day, 6days, 16+ tsandcs apply reply hl 4 info",1,generic_spam,en,uci_spam
"urgent! you have won a 1 week free membership in our ï¿½100,000 prize jackpot! txt the word: claim to no: <otp> t&c <url> lccltd pobox <otp>ldnw1a7rw18",1,generic_spam,en,uci_spam
i've been searching for the right words to thank you for this breather. i promise i wont take your help for granted and will fulfil my promise. you have been wonderful and a blessing at all times.,0,safe_generic,en,uci_spam
i have a date on sunday with will!!,0,safe_generic,en,uci_spam
"xxxmobilemovieclub: to use your credit, click the wap link in the next txt message or click here>> <url> xxxmobilemovieclub.com?n=qjkgighjjgcbl",1,generic_spam,en,uci_spam
oh k...i'm watching here:),0,safe_generic,en,uci_spam
eh u remember how 2 spell his name... yes i did. he v naughty make until i v wet.,0,safe_generic,en,uci_spam
fine if thatï¿½ï¿½s the way u feel. thatï¿½ï¿½s the way its gota b,0,safe_generic,en,uci_spam
"england v macedonia - dont miss the goals/team news. txt ur national team to <otp> eg england to <otp> try:wales, scotland 4txt/ì¼1.20 poboxox<otp>w45wq 16+",1,generic_spam,en,uci_spam
is that seriously how you spell his name?,0,safe_generic,en,uci_spam
iï¿½ï¿½ï¿½m going to try for 2 months ha ha only joking,0,safe_generic,en,uci_spam
so ï¿½_ pay first lar... then when is da stock comin...,0,safe_generic,en,uci_spam
aft i finish my lunch then i go str down lor. ard 3 smth lor. u finish ur lunch already?,0,safe_generic,en,uci_spam
ffffffffff. alright no way i can meet up with you sooner?,0,safe_generic,en,uci_spam
just forced myself to eat a slice. i'm really not hungry tho. this sucks. mark is getting worried. he knows i'm sick when i turn down pizza. lol,0,safe_generic,en,uci_spam
lol your always so convincing.,0,safe_generic,en,uci_spam
did you catch the bus ? are you frying an egg ? did you make a tea? are you eating your mom's left over dinner ? do you feel my love ?,0,safe_generic,en,uci_spam
"i'm back &amp; we're packing the car now, i'll let you know if there's room",0,safe_generic,en,uci_spam
ahhh. work. i vaguely remember that! what does it feel like? lol,0,safe_generic,en,uci_spam
"wait that's still not all that clear, were you not sure about me being sarcastic or that that's why x doesn't want to live with us",0,safe_generic,en,uci_spam
yeah he got in at 2 and was v apologetic. n had fallen out and she was actin like spoilt child and he got caught up in that. till 2! but we won't go there! not doing too badly cheers. you?,0,safe_generic,en,uci_spam
k tell me anything about you.,0,safe_generic,en,uci_spam
for fear of fainting with the of all that housework you just did? quick have a cuppa,0,safe_generic,en,uci_spam
thanks for your subscription to ringtone uk your mobile will be charged ï¿½5/month please confirm by replying yes or no. if you reply no you will not be charged,1,generic_spam,en,uci_spam
yup... ok i go home look at the timings then i msg ï¿½_ again... xuhui going to learn on 2nd may too but her lesson is at 8am,0,safe_generic,en,uci_spam
"oops, i'll let you know when my roommate's done",0,safe_generic,en,uci_spam
i see the letter b on my car,0,safe_generic,en,uci_spam
anything lor... u decide...,0,safe_generic,en,uci_spam
hello! how's you and how did saturday go? i was just texting to see if you'd decided to do anything tomo. not that i'm trying to invite myself or anything!,0,safe_generic,en,uci_spam
pls go ahead with watts. i just wanted to be sure. do have a great weekend. abiola,0,safe_generic,en,uci_spam
"did i forget to tell you ? i want you , i need you, i crave you ... but most of all ... i love you my sweet arabian steed ... mmmmmm ... yummy",0,safe_generic,en,uci_spam
<acct> - rodger burns - msg = we tried to call you re your reply to our sms for a free nokia mobile + free camcorder. please call now <acct> for delivery tomorrow,1,generic_spam,en,uci_spam
who are you seeing?,0,safe_generic,en,uci_spam
great! i hope you like your man well endowed. i am &lt;#&gt; inches...,0,safe_generic,en,uci_spam
no calls..messages..missed calls,0,safe_generic,en,uci_spam
didn't you get hep b immunisation in nigeria.,0,safe_generic,en,uci_spam
"fair enough, anything going on?",0,safe_generic,en,uci_spam
"yeah hopefully, if tyler can't do it i could maybe ask around a bit",0,safe_generic,en,uci_spam
u don't know how stubborn i am. i didn't even want to go to the hospital. i kept telling mark i'm not a weak sucker. hospitals are for weak suckers.,0,safe_generic,en,uci_spam
what you thinked about me. first time you saw me in class.,0,safe_generic,en,uci_spam
"a gram usually runs like &lt;#&gt; , a half eighth is smarter though and gets you almost a whole second gram for &lt;#&gt;",0,safe_generic,en,uci_spam
k fyi x has a ride early tomorrow morning but he's crashing at our place tonight,0,safe_generic,en,uci_spam
"wow. i never realized that you were so embarassed by your accomodations. i thought you liked it, since i was doing the best i could and you always seemed so happy about \the cave\"". i'm sorry i didn't and don't have more to give. i'm sorry i offered. i'm sorry your room was so embarassing.""",0,safe_generic,en,uci_spam
sms. ac sptv: the new jersey devils and the detroit red wings play ice hockey. correct or incorrect? end? reply end sptv,1,generic_spam,en,uci_spam
do you know what mallika sherawat did yesterday? find out now @ &lt;url&gt;,0,safe_generic,en,uci_spam
"congrats! 1 year special cinema pass for 2 is yours. call <acct> now! c suprman v, matrix3, starwa<amount> etc all 4 free! bx420-ip4-5we. 150pm. dont miss out!",1,generic_spam,en,uci_spam
"sorry, i'll call later in meeting.",0,safe_generic,en,uci_spam
tell where you reached,0,safe_generic,en,uci_spam
yes..gauti and sehwag out of odi series.,0,safe_generic,en,uci_spam
your gonna have to pick up a $1 burger for yourself on your way home. i can't even move. pain is killing me.,0,safe_generic,en,uci_spam
ha ha ha good joke. girls are situation seekers.,0,safe_generic,en,uci_spam
its a part of checking iq,0,safe_generic,en,uci_spam
"sorry my roommates took forever, it ok if i come by now?",0,safe_generic,en,uci_spam
ok lar i double check wif da hair dresser already he said wun cut v short. he said will cut until i look nice.,0,safe_generic,en,uci_spam
"as a valued customer, i am pleased to advise you that following recent review of your mob no. you are awarded with a ï¿½<otp> bonus prize, call <acct>",1,generic_spam,en,uci_spam
"today is \song dedicated day..\"" which song will u dedicate for me? send this to all ur valuable frnds but first rply me...""",0,safe_generic,en,uci_spam
"urgent ur awarded a complimentary trip to eurodisinc trav, aco&entry41 or ï¿½<otp>. to claim txt dis to <otp> 18+6*ï¿½1.50(morefrmmob. shracomorsglsuplt)10, ls1 3aj",1,generic_spam,en,uci_spam
"did you hear about the new \divorce barbie\""? it comes with all of ken's stuff!""",1,generic_spam,en,uci_spam
i plane to give on this month end.,0,safe_generic,en,uci_spam
wah lucky man... then can save money... hee...,0,safe_generic,en,uci_spam
finished class where are you.,0,safe_generic,en,uci_spam
<name> at home now wanna do something? xx,0,safe_generic,en,uci_spam
k..k:)where are you?how did you performed?,0,safe_generic,en,uci_spam
u can call me now...,0,safe_generic,en,uci_spam
i am waiting machan. call me once you free.,0,safe_generic,en,uci_spam
thats cool. i am a gentleman and will treat you with dignity and respect.,0,safe_generic,en,uci_spam
i like you peoples very much:) but am very shy pa.,0,safe_generic,en,uci_spam
does not operate after &lt;#&gt; or what,0,safe_generic,en,uci_spam
its not the same here. still looking for a job. how much do ta's earn there.,0,safe_generic,en,uci_spam
"sorry, i'll call later",0,safe_generic,en,uci_spam
